abstract,web_url,snippet,lead_paragraph,print_section,print_page,source,multimedia,keywords,pub_date,document_type,news_desk,section_name,type_of_material,_id,word_count,uri,headline.main,headline.kicker,headline.content_kicker,headline.print_headline,headline.name,headline.seo,headline.sub,byline.original,byline.person,byline.organization,query_consulta,subsection_name
Patients in early stages of Alzheimer's disease speak at Annual Mayoral Council on Alzheimer's Disease; patients are from support group run by Alzheimer's Assn; idea is to show doctors and others that Alzheimer's patients are still people; photo (M),https://www.nytimes.com/1997/01/01/us/alzheimer-patients-present-a-lesson-on-human-dignity.html,Patients in early stages of Alzheimer's disease speak at Annual Mayoral Council on Alzheimer's Disease; patients are from support group run by Alzheimer's Assn; idea is to show doctors and others that Alzheimer's patients are still people; photo (...,"THEY looked for all the world like elderly professionals, dressed casually in the typical New York hues of black and gray. But the two women and one man, sitting in front of a packed room at a recent meeting on Alzheimer's disease, were not researchers or directors of programs. They were patients, they had Alzheimer's disease and they were there to tell what it was like to know you have a disease that is slowly, inexorably, killing your brain.",1,54,The New York Times,[],"[{'name': 'organizations', 'value': ""ALZHEIMER'S ASSN"", 'rank': 1, 'major': 'N'}, {'name': 'subject', 'value': ""Alzheimer's Disease"", 'rank': 2, 'major': 'N'}]",1997-01-01T05:00:00+0000,article,National Desk,U.S.,News,nyt://article/dc7e1ec2-2d8d-5103-9a2a-b21498f987b0,1046,nyt://article/dc7e1ec2-2d8d-5103-9a2a-b21498f987b0,Alzheimer Patients Present a Lesson On Human Dignity,,,Alzheimer Patients Present a Lesson On Human Dignity,,,,By Gina Kolata,"[{'firstname': 'Gina', 'middlename': None, 'lastname': 'Kolata', 'qualifier': None, 'title': None, 'role': 'reported', 'organization': '', 'rank': 1}]",,Alzheimer,
Eli Lilly & Co reaches five-year deal to pay Neurocrine Biosciences Inc $74 milion in cash to develop new drugs for obesity and Alzheimer's disease (S),https://www.nytimes.com/1996/10/22/business/lilly-paying-for-obesity-and-alzheimer-study.html,Eli Lilly & Co reaches five-year deal to pay Neurocrine Biosciences Inc $74 milion in cash to develop new drugs for obesity and Alzheimer's disease (S),"Eli Lilly & Company has reached a five-year deal to pay Neurocrine Biosciences Inc. $74 million in cash to develop new drugs for obesity and Alzheimer's disease, the companies said yesterday. The accord provides financial and scientific backing for new compounds that Neurocrine is testing to treat those diseases, which are both linked with depressed levels of a hormone, called corticotropin releasing factor, or C.R.F. Neurocrine, based in San Diego, is a four-year-old biotechnology company developing drugs for disorders of the central nervous system and the immune system. Under the pact, Neurocrine will receive $22 million in initial fees and financing, including $10 million the first year.",D,4,The New York Times,[],"[{'name': 'organizations', 'value': 'Neurocrine Biosciences Inc', 'rank': 1, 'major': 'N'}, {'name': 'organizations', 'value': 'Lilly, Eli, & Co', 'rank': 2, 'major': 'N'}, {'name': 'subject', 'value': 'Weight', 'rank': 3, 'major': 'N'}, {'name': 'subject', 'value': ""Alzheimer's Disease"", 'rank': 4, 'major': 'N'}, {'name': 'subject', 'value': 'Drugs (Pharmaceuticals)', 'rank': 5, 'major': 'N'}]",1996-10-22T05:00:00+0000,article,Business/Financial Desk,Business Day,News,nyt://article/fe275807-fd69-5e7c-b148-7c4e13d969f3,107,nyt://article/fe275807-fd69-5e7c-b148-7c4e13d969f3,LILLY PAYING FOR OBESITY AND ALZHEIMER STUDY,COMPANY NEWS,,LILLY PAYING FOR OBESITY AND ALZHEIMER STUDY,,,,By Dow Jones,"[{'firstname': 'Dow', 'middlename': None, 'lastname': 'Jones', 'qualifier': None, 'title': None, 'role': 'reported', 'organization': '', 'rank': 1}]",,Alzheimer,
Researchers report taking estrogen after menopause may reduce woman's risk of developing Alzheimer's or delay onset of disease (M),https://www.nytimes.com/1996/08/16/us/estrogen-may-reduce-alzheimer-s-risk-in-women-study-says.html,Researchers report taking estrogen after menopause may reduce woman's risk of developing Alzheimer's or delay onset of disease (M),"Taking estrogen after menopause may reduce a woman's risk of developing Alzheimer's or delay onset of the disease, scientists said yesterday.",A,18,The New York Times,[],"[{'name': 'subject', 'value': 'Estrogen', 'rank': 1, 'major': 'N'}, {'name': 'subject', 'value': 'Hormones', 'rank': 2, 'major': 'N'}, {'name': 'subject', 'value': ""Alzheimer's Disease"", 'rank': 3, 'major': 'N'}, {'name': 'subject', 'value': 'Women', 'rank': 4, 'major': 'N'}, {'name': 'subject', 'value': 'Menopause', 'rank': 5, 'major': 'N'}, {'name': 'subject', 'value': 'Research', 'rank': 6, 'major': 'N'}]",1996-08-16T05:00:00+0000,article,National Desk,U.S.,News,nyt://article/3be14f80-323a-5659-b127-ce43f98319db,525,nyt://article/3be14f80-323a-5659-b127-ce43f98319db,"Estrogen May Reduce Alzheimer's Risk in Women, Study Says",,,"Estrogen May Reduce Alzheimer's Risk in Women, Study Says",,,,,[],,Alzheimer,
"THE researchers who study Alzheimer's disease are a relentlessly upbeat bunch. They are on the verge, they say, of finding a way to diagnose the disease with a simple blood test. Quite soon, they say, they will turn up a way to delay its onset or slow its course. Any day now, they say, drugs will emerge that prevent the disease in people who would otherwise get it.         More and more scientists are being recruited into the field. An international meeting last week in Osaka, Japan, drew 1,300 participants, nearly twice the number who attended a similar meeting last year.   ",https://www.nytimes.com/1996/07/30/science/hopes-are-rosy-on-alzheimer-s-but-results-slim.html,,"THE researchers who study Alzheimer's disease are a relentlessly upbeat bunch. They are on the verge, they say, of finding a way to diagnose the disease with a simple blood test. Quite soon, they say, they will turn up a way to delay its onset or slow its course. Any day now, they say, drugs will emerge that prevent the disease in people who would otherwise get it.",C,1,The New York Times,[],"[{'name': 'subject', 'value': 'TESTS ANDTESTING', 'rank': 1, 'major': 'N'}, {'name': 'subject', 'value': ""Alzheimer's Disease"", 'rank': 2, 'major': 'N'}, {'name': 'subject', 'value': 'Drugs (Pharmaceuticals)', 'rank': 3, 'major': 'N'}, {'name': 'subject', 'value': 'Research', 'rank': 4, 'major': 'N'}]",1996-07-30T05:00:00+0000,article,Science Desk,Science,News,nyt://article/23df3c4a-8d36-56b9-8cca-328e70a03e25,1670,nyt://article/23df3c4a-8d36-56b9-8cca-328e70a03e25,"Hopes Are Rosy On Alzheimer's, But Results Slim",,,"Hopes Are Rosy On Alzheimer's, But Results Slim",,,,By Gina Kolata,"[{'firstname': 'Gina', 'middlename': None, 'lastname': 'Kolata', 'qualifier': None, 'title': None, 'role': 'reported', 'organization': '', 'rank': 1}]",,Alzheimer,
"AS the number of patients with Alzheimer's disease continues to climb, researchers are studying the possibility that a common and already approved drug, estrogen, may help to prevent or delay it, and even reverse some of its symptoms.         Though far from conclusive, the evidence so far is highly suggestive. The evidence, derived from experimental animals and from women after menopause taking estrogen supplements, has prompted two major studies to assess the effectiveness of estrogen replacement in currently healthy older women and in those in the early stages of the disease.   ",https://www.nytimes.com/1996/07/31/us/tantalizing-data-suggest-estrogen-may-prevent-or-delay-alzheimer-s.html,,"AS the number of patients with Alzheimer's disease continues to climb, researchers are studying the possibility that a common and already approved drug, estrogen, may help to prevent or delay it, and even reverse some of its symptoms.",C,7,The New York Times,[],"[{'name': 'subject', 'value': 'Estrogen', 'rank': 1, 'major': 'N'}, {'name': 'subject', 'value': 'Hormones', 'rank': 2, 'major': 'N'}, {'name': 'subject', 'value': ""Alzheimer's Disease"", 'rank': 3, 'major': 'N'}, {'name': 'subject', 'value': 'Testosterone', 'rank': 4, 'major': 'N'}, {'name': 'subject', 'value': 'Men', 'rank': 5, 'major': 'N'}, {'name': 'subject', 'value': 'Women', 'rank': 6, 'major': 'N'}, {'name': 'subject', 'value': 'Menopause', 'rank': 7, 'major': 'N'}, {'name': 'subject', 'value': 'Research', 'rank': 8, 'major': 'N'}]",1996-07-31T05:00:00+0000,article,National Desk,U.S.,News,nyt://article/2571a13d-a20e-5d60-ba76-33feb2326f09,884,nyt://article/2571a13d-a20e-5d60-ba76-33feb2326f09,Tantalizing Data Suggest Estrogen May Prevent or Delay Alzheimer's,,,Tantalizing Data Suggest Estrogen May Prevent or Delay Alzheimer's,,,,By Jane E. Brody,"[{'firstname': 'Jane', 'middlename': 'E.', 'lastname': 'Brody', 'qualifier': None, 'title': None, 'role': 'reported', 'organization': '', 'rank': 1}]",,Alzheimer,
"A noted Alzheimer's disease researcher and his daughter were found shot to death on Wednesday morning at their home in San Diego, the police said today.         Tsunao Saitoh, 46, a professor at the University of California at San Diego,  and his 13-year-old daughter, Loullie, were killed in front of their home in the La Jolla section of San Diego.   ",https://www.nytimes.com/1996/05/10/us/alzheimer-s-researcher-is-found-slain.html,,"A noted Alzheimer's disease researcher and his daughter were found shot to death on Wednesday morning at their home in San Diego, the police said today.",A,24,The New York Times,[],"[{'name': 'glocations', 'value': 'SAN DIEGO, CA, USA', 'rank': 1, 'major': 'N'}, {'name': 'glocations', 'value': 'San Diego (Calif)', 'rank': 2, 'major': 'N'}, {'name': 'glocations', 'value': 'California', 'rank': 3, 'major': 'N'}, {'name': 'persons', 'value': 'Saitoh, Tsunao', 'rank': 4, 'major': 'N'}, {'name': 'persons', 'value': 'Saitoh, Loullie', 'rank': 5, 'major': 'N'}, {'name': 'subject', 'value': 'Murders and Attempted Murders', 'rank': 6, 'major': 'N'}]",1996-05-10T05:00:00+0000,article,National Desk,U.S.,News,nyt://article/78eae549-a741-5d6c-8631-bf00b3a7aaf1,338,nyt://article/78eae549-a741-5d6c-8631-bf00b3a7aaf1,Alzheimer's Researcher Is Found Slain,,,Alzheimer's Researcher Is Found Slain,,,,By The New York Times,[],The New York Times,Alzheimer,
"Alzheimer's disease, the dreaded affliction of old age, might show its first  subtle effects when its victims are as young as 20.         In a study based on the autobiographies of young women about to join an order of nuns, researchers have reported that the women's writing styles when they were in their 20's predicted with uncanny accuracy which of them would be severely demented with Alzheimer's disease six decades later. The study was published today in the Journal of the American Medical Association.   ",https://www.nytimes.com/1996/02/21/us/research-links-writing-style-to-the-risk-of-alzheimer-s.html,,"Alzheimer's disease, the dreaded affliction of old age, might show its first subtle effects when its victims are as young as 20.",A,12,The New York Times,[],"[{'name': 'organizations', 'value': 'University of Kentucky', 'rank': 1, 'major': 'N'}, {'name': 'subject', 'value': ""Alzheimer's Disease"", 'rank': 2, 'major': 'N'}, {'name': 'subject', 'value': 'Writing and Writers', 'rank': 3, 'major': 'N'}, {'name': 'subject', 'value': 'Women', 'rank': 4, 'major': 'N'}, {'name': 'subject', 'value': 'Research', 'rank': 5, 'major': 'N'}]",1996-02-21T05:00:00+0000,article,National Desk,U.S.,News,nyt://article/50d39e1a-8a4c-50ae-8fe2-1452bd971f29,1798,nyt://article/50d39e1a-8a4c-50ae-8fe2-1452bd971f29,Research Links Writing Style to the Risk of Alzheimer's,,,Research Links Writing Style to the Risk of Alzheimer's,,,,By Gina Kolata,"[{'firstname': 'Gina', 'middlename': None, 'lastname': 'Kolata', 'qualifier': None, 'title': None, 'role': 'reported', 'organization': '', 'rank': 1}]",,Alzheimer,
"NEW discoveries about the earliest signs of Alzheimer's disease in the brain  may one day offer a way to make the diagnosis well before the disease has produced senility, allowing people to make plans for their futures while they are still lucid.         Although such a diagnosis is not possible at the moment, studies with two brain imaging techniques, the PET scan and M.R.I., have shown early changes in the brain that seem to be precursors of Alzheimer's disease. In one study, Dr. Gary Small, a psychiatrist at the University of California at Los Angeles, recruited 42 volunteers who were concerned about mild problems like misplacing household objects and who had a parent or sibling who had had Alzheimer's disease. The volunteers were as young as 41, with an average age of 60.   ",https://www.nytimes.com/1996/01/31/us/studies-using-brain-imaging-hint-at-alzheimer-precursors.html,,"NEW discoveries about the earliest signs of Alzheimer's disease in the brain may one day offer a way to make the diagnosis well before the disease has produced senility, allowing people to make plans for their futures while they are still lucid.",C,10,The New York Times,[],"[{'name': 'subject', 'value': 'MAGNETICRESONANCE IMAGERS', 'rank': 1, 'major': 'N'}, {'name': 'subject', 'value': ""Alzheimer's Disease"", 'rank': 2, 'major': 'N'}, {'name': 'subject', 'value': 'Brain', 'rank': 3, 'major': 'N'}, {'name': 'subject', 'value': 'POSITRON EMISSION TOMOGRAPHY (PET)', 'rank': 4, 'major': 'N'}]",1996-01-31T05:00:00+0000,article,National Desk,U.S.,News,nyt://article/c5c0aae9-c21b-5d48-83ad-f94baa2126e5,1188,nyt://article/c5c0aae9-c21b-5d48-83ad-f94baa2126e5,Studies Using Brain Imaging Hint at Alzheimer Precursors,,,Studies Using Brain Imaging Hint at Alzheimer Precursors,,,,By Daniel Goleman,"[{'firstname': 'Daniel', 'middlename': None, 'lastname': 'Goleman', 'qualifier': None, 'title': None, 'role': 'reported', 'organization': '', 'rank': 1}]",,Alzheimer,
"Dr. George Margolis, a Dartmouth College neuropathologist who did some of the early research into Alzheimer's disease, died on Thursday at his home in Ridgefield, Conn. He was 81.         He had been in failing health after a series of strokes, his family said.   ",https://www.nytimes.com/1996/04/27/nyregion/george-margolis-81-who-pioneered-early-studies-on-alzheimer-s.html,,"Dr. George Margolis, a Dartmouth College neuropathologist who did some of the early research into Alzheimer's disease, died on Thursday at his home in Ridgefield, Conn. He was 81.",1,30,The New York Times,[],"[{'name': 'persons', 'value': 'Margolis, George', 'rank': 1, 'major': 'N'}, {'name': 'subject', 'value': ""Alzheimer's Disease"", 'rank': 2, 'major': 'N'}, {'name': 'subject', 'value': 'DEATHS', 'rank': 3, 'major': 'N'}]",1996-04-27T05:00:00+0000,article,Metropolitan Desk,New York,Obituary; Biography,nyt://article/d59db0a2-f6cb-5924-af31-d0b8fb796ca1,344,nyt://article/d59db0a2-f6cb-5924-af31-d0b8fb796ca1,"George Margolis, 81, Who Pioneered Early Studies on Alzheimer's",,,"George Margolis, 81, Who Pioneered Early Studies on Alzheimer's",,,,By Wolfgang Saxon,"[{'firstname': 'Wolfgang', 'middlename': None, 'lastname': 'Saxon', 'qualifier': None, 'title': None, 'role': 'reported', 'organization': '', 'rank': 1}]",,Alzheimer,
Stanford M Singer/Karen Dahlman letter disputes July 30 Science Times article on treatment of Alzheimer's disease (S),https://www.nytimes.com/1996/08/02/opinion/l-all-is-not-bleak-in-treatment-of-alzheimer-s-647667.html,Stanford M Singer/Karen Dahlman letter disputes July 30 Science Times article on treatment of Alzheimer's disease (S),To the Editor,A,26,The New York Times,[],"[{'name': 'persons', 'value': 'Dahlman, Karen', 'rank': 1, 'major': 'N'}, {'name': 'persons', 'value': 'Singer, Stanford M', 'rank': 2, 'major': 'N'}, {'name': 'subject', 'value': ""Alzheimer's Disease"", 'rank': 3, 'major': 'N'}, {'name': 'subject', 'value': 'Research', 'rank': 4, 'major': 'N'}]",1996-08-02T05:00:00+0000,article,Editorial Desk,Opinion,Letter,nyt://article/a7113b19-88dc-51e6-96ef-c786c4825233,160,nyt://article/a7113b19-88dc-51e6-96ef-c786c4825233,All Is Not Bleak in Treatment of Alzheimer's,,,All Is Not Bleak in Treatment of Alzheimer's,,,,,[],,Alzheimer,
Roger Granet/Eileen Fallon letter disputes July 30 Science Times article on treatment of Alzheimer's disease (S),https://www.nytimes.com/1996/08/02/opinion/l-all-is-not-bleak-in-treatment-of-alzheimer-s-633496.html,Roger Granet/Eileen Fallon letter disputes July 30 Science Times article on treatment of Alzheimer's disease (S),To the Editor:,A,26,The New York Times,[],"[{'name': 'persons', 'value': 'Granet, Roger', 'rank': 1, 'major': 'N'}, {'name': 'persons', 'value': 'Fallon, Eileen', 'rank': 2, 'major': 'N'}, {'name': 'subject', 'value': ""Alzheimer's Disease"", 'rank': 3, 'major': 'N'}, {'name': 'subject', 'value': 'Research', 'rank': 4, 'major': 'N'}]",1996-08-02T05:00:00+0000,article,Editorial Desk,Opinion,Letter,nyt://article/4bad6fef-53e4-5f5e-bf79-1d8be597344b,228,nyt://article/4bad6fef-53e4-5f5e-bf79-1d8be597344b,All Is Not Bleak in Treatment of Alzheimer's,,,All Is Not Bleak in Treatment of Alzheimer's,,,,,[],,Alzheimer,
"To the Editor:         In your Feb. 21 news article on the researchers who studied the writing style of 93 nuns when they were young women about to join an order, you say they found that the more grammatically and ideationally complex writers were less likely to develop Alzheimer's disease in later years.   ",https://www.nytimes.com/1996/02/24/opinion/l-emotion-may-have-a-role-in-alzheimer-s-066427.html,,To the Editor:,1,20,The New York Times,[],"[{'name': 'persons', 'value': 'Massie, Henry', 'rank': 1, 'major': 'N'}, {'name': 'subject', 'value': ""Alzheimer's Disease"", 'rank': 2, 'major': 'N'}, {'name': 'subject', 'value': 'Writing and Writers', 'rank': 3, 'major': 'N'}, {'name': 'subject', 'value': 'Research', 'rank': 4, 'major': 'N'}]",1996-02-24T05:00:00+0000,article,Editorial Desk,Opinion,Letter,nyt://article/7a57c6c2-7eb8-5a19-8278-8b27efd83db5,158,nyt://article/7a57c6c2-7eb8-5a19-8278-8b27efd83db5,Emotion May Have a Role in Alzheimer's,,,Emotion May Have a Role in Alzheimer's,,,,,[],,Alzheimer,
"To the Editor:         Since I am 74 years old and getting older, I have often wondered what miracle has spared me from Alzheimer's disease. Now it turns out that simple, direct exposition, unornamented with lush adjectives and adverbs, puts one at high risk for Alzheimer's (news article, Feb. 21).   ",https://www.nytimes.com/1996/02/24/opinion/l-emotion-may-have-a-role-in-alzheimer-s-066435.html,,To the Editor:,1,20,The New York Times,[],"[{'name': 'persons', 'value': 'Carlson, Gordon', 'rank': 1, 'major': 'N'}, {'name': 'subject', 'value': ""Alzheimer's Disease"", 'rank': 2, 'major': 'N'}, {'name': 'subject', 'value': 'Writing and Writers', 'rank': 3, 'major': 'N'}, {'name': 'subject', 'value': 'Research', 'rank': 4, 'major': 'N'}]",1996-02-24T05:00:00+0000,article,Editorial Desk,Opinion,Letter,nyt://article/12ce93ff-66a9-5db3-aead-443c75074e73,158,nyt://article/12ce93ff-66a9-5db3-aead-443c75074e73,Emotion May Have a Role in Alzheimer's,,,Emotion May Have a Role in Alzheimer's,,,,,[],,Alzheimer,
"The stars come out for the Met, Carnegie Hall, Alzheimer's research and the Acting Company.  ",https://www.nytimes.com/1996/11/02/style/emerging-from-the-footlights.html,,"The stars come out for the Met, Carnegie Hall, Alzheimer's research and the Acting Company.",1,55,The New York Times,[],[],1996-11-02T05:00:00+0000,article,Style Desk,Style,News,nyt://article/a33ca5a6-2ccf-509e-91fd-0cf406fa0ca6,15,nyt://article/a33ca5a6-2ccf-509e-91fd-0cf406fa0ca6,Emerging From the Footlights,EVENING HOURS,,Emerging From the Footlights,,,,,[],,Alzheimer,
"EVEN Hippocrates knew that a blow to the head can leave bruises on the mind.  By studying the effects of brain injuries, he demonstrated that the mind is centered not in the heart, as some romantics believed, but right behind the eyes.         It has taken centuries and the invention of brain-scanning to show that the connection between mind and brain is a two-way street: changing the mind, oddly  enough, can alter the physical substance of the brain. But for all the scientific evidence, the interaction between what we think of as the material brain and the ethereal mind remains a source of wonder.   ",https://www.nytimes.com/1996/02/25/weekinreview/ideas-trends-yes-there-is-such-a-thing-as-mind-over-matter.html,,"EVEN Hippocrates knew that a blow to the head can leave bruises on the mind. By studying the effects of brain injuries, he demonstrated that the mind is centered not in the heart, as some romantics believed, but right behind the eyes.",4,3,The New York Times,[],"[{'name': 'subject', 'value': ""Alzheimer's Disease"", 'rank': 1, 'major': 'N'}, {'name': 'subject', 'value': 'Brain', 'rank': 2, 'major': 'N'}, {'name': 'subject', 'value': 'Mental Health and Disorders', 'rank': 3, 'major': 'N'}]",1996-02-25T05:00:00+0000,article,Week in Review Desk,Week in Review,News,nyt://article/56217e15-32f5-5fa8-9ed0-48e5eb611837,832,nyt://article/56217e15-32f5-5fa8-9ed0-48e5eb611837,"IDEAS & TRENDS;Yes, There Is Such a Thing As Mind Over Matter",IDEAS & TRENDS,,"IDEAS & TRENDS;Yes, There Is Such a Thing As Mind Over Matter",,,,By George Johnson,"[{'firstname': 'George', 'middlename': None, 'lastname': 'Johnson', 'qualifier': None, 'title': None, 'role': 'reported', 'organization': '', 'rank': 1}]",,Alzheimer,
"A patient with Alzheimer's disease should stay with the son who wants him to  live, rather than with other relatives who may try to take him to see Dr. Jack Kevorkian, who has attended 26 suicides of ill people, a judge ruled today.         The son, Chip Klooster, earlier won temporary custody of his 69-year-old father, Gerald Klooster, a retired doctor who has been found mentally incompetent, after he learned that other members of the family had contacted Dr. Kevorkian. The action today by Judge Fred Mulhauser of Emmet County Probate Court continued that order of temporary custody indefinitely.   ",https://www.nytimes.com/1996/01/24/us/suicide-backers-lose-in-custody-dispute.html,,"A patient with Alzheimer's disease should stay with the son who wants him to live, rather than with other relatives who may try to take him to see Dr. Jack Kevorkian, who has attended 26 suicides of ill people, a judge ruled today.",A,11,The New York Times,[],"[{'name': 'persons', 'value': 'Klooster, Gerald Jack Kevorkian', 'rank': 1, 'major': 'N'}, {'name': 'persons', 'value': 'Kevorkian, Jack', 'rank': 2, 'major': 'N'}, {'name': 'subject', 'value': ""Alzheimer's Disease"", 'rank': 3, 'major': 'N'}, {'name': 'subject', 'value': 'DEATH', 'rank': 4, 'major': 'N'}, {'name': 'subject', 'value': 'Mental Retardation', 'rank': 5, 'major': 'N'}, {'name': 'subject', 'value': 'Suicides and Suicide Attempts', 'rank': 6, 'major': 'N'}, {'name': 'subject', 'value': 'DECISIONSAND VERDICTS', 'rank': 7, 'major': 'N'}]",1996-01-24T05:00:00+0000,article,National Desk,U.S.,News,nyt://article/67ee0d1a-f87a-546b-8038-59eea833c231,193,nyt://article/67ee0d1a-f87a-546b-8038-59eea833c231,Suicide Backers Lose in Custody Dispute,,,Suicide Backers Lose in Custody Dispute,,,,AP,[],AP,Alzheimer,
"New Hebrew Hospital Home of Westchester, now under construction in Greenburgh, will offer residents maximum freedom of movement within sheltered grounds; drawing (S)s",https://www.nytimes.com/1996/12/22/realestate/new-nursing-home-rising-in-westchester.html,"New Hebrew Hospital Home of Westchester, now under construction in Greenburgh, will offer residents maximum freedom of movement within sheltered grounds; drawing (S)s",Residents with Alzheimer's dementia will have the freedom of walking safely around their own landscaped garden when the new two-story Hebrew Hospital Home of Westchester is completed on a 30-acre site along Grasslands Road in the Town of Greenburgh by the summer of 1998.,9,1,The New York Times,[],"[{'name': 'glocations', 'value': 'Westchester County (NY)', 'rank': 1, 'major': 'N'}, {'name': 'organizations', 'value': 'Hebrew Hospital Home of Westchester', 'rank': 2, 'major': 'N'}, {'name': 'subject', 'value': 'Nursing Homes', 'rank': 3, 'major': 'N'}]",1996-12-22T05:00:00+0000,article,Real Estate Desk,Real Estate,News,nyt://article/492891bb-5d68-5142-8bbe-13a79987da32,306,nyt://article/492891bb-5d68-5142-8bbe-13a79987da32,New Nursing Home Rising in Westchester,POSTINGS: Hebrew Hospital Home in Greenburgh to Include 40-Bed Alzheimer's Unit,,New Nursing Home Rising in Westchester,,,,,[],,Alzheimer,
"The State Health Department has started an investigation into why an elderly  man received an operation on the wrong hip.         The man, Frank Perrin, an 84-year-old Alzheimer's patient, was in stable condition today at Champlain Valley Physicians Hospital Medical Center after undergoing surgery for a second time to repair the correct hip. Mr. Perrin was originally operated on at Adirondack Medical Center here, where pins were placed in the wrong hip. The mistake was discovered by nurses at his Lake Placid nursing home.   ",https://www.nytimes.com/1996/01/29/nyregion/operation-on-wrong-hip.html,,The State Health Department has started an investigation into why an elderly man received an operation on the wrong hip.,B,4,The New York Times,[],"[{'name': 'organizations', 'value': 'Adirondack Medical Center', 'rank': 1, 'major': 'N'}, {'name': 'subject', 'value': 'Hips', 'rank': 2, 'major': 'N'}, {'name': 'subject', 'value': 'Surgery and Surgeons', 'rank': 3, 'major': 'N'}]",1996-01-29T05:00:00+0000,article,Metropolitan Desk,New York,News,nyt://article/6f601681-8bfb-5f8e-b946-827618a48387,110,nyt://article/6f601681-8bfb-5f8e-b946-827618a48387,Operation on Wrong Hip,,,Operation on Wrong Hip,,,,AP,[],AP,Alzheimer,
