abstract,web_url,snippet,lead_paragraph,print_section,print_page,source,multimedia,keywords,pub_date,document_type,news_desk,section_name,subsection_name,type_of_material,_id,word_count,uri,headline.main,headline.kicker,headline.content_kicker,headline.print_headline,headline.name,headline.seo,headline.sub,byline.original,byline.person,byline.organization,query_consulta,slideshow_credits
"The trial of former President Jacques Chirac on charges of corruption reopened on Monday, but Mr. Chirac was absent due to illness, according to his lawyers.",https://www.nytimes.com/2011/09/06/world/europe/06france.html,"The trial of former President Jacques Chirac on charges of corruption reopened on Monday, but Mr. Chirac was absent due to illness, according to his lawyers.","PARIS — The trial of former President Jacques Chirac of France on corruption charges will proceed without Mr. Chirac having to be present, a court decided Monday, citing the poor state of Mr. Chirac’s mental health.",A,8,The New York Times,"[{'rank': 0, 'subtype': 'blog480', 'caption': None, 'credit': None, 'type': 'image', 'url': 'images/2011/09/06/world/06france-inline1/06france-inline1-blog480.jpg', 'height': 335, 'width': 480, 'legacy': {}, 'subType': 'blog480', 'crop_name': 'blog480'}, {'rank': 0, 'subtype': 'jumbo', 'caption': None, 'credit': None, 'type': 'image', 'url': 'images/2011/09/06/world/06france-inline1/06france-inline1-jumbo.jpg', 'height': 714, 'width': 1024, 'legacy': {}, 'subType': 'jumbo', 'crop_name': 'jumbo'}, {'rank': 0, 'subtype': 'popup', 'caption': None, 'credit': None, 'type': 'image', 'url': 'images/2011/09/06/world/06france-inline1/06france-inline1-popup.jpg', 'height': 453, 'width': 650, 'legacy': {}, 'subType': 'popup', 'crop_name': 'popup'}, {'rank': 0, 'subtype': 'articleInline', 'caption': None, 'credit': None, 'type': 'image', 'url': 'images/2011/09/06/world/06france-inline1/06france-inline1-articleInline.jpg', 'height': 133, 'width': 190, 'legacy': {}, 'subType': 'articleInline', 'crop_name': 'articleInline'}, {'rank': 0, 'subtype': 'sfSpan', 'caption': None, 'credit': None, 'type': 'image', 'url': 'images/2011/09/06/world/06france-inline1/06france-inline1-sfSpan.jpg', 'height': 275, 'width': 395, 'legacy': {}, 'subType': 'sfSpan', 'crop_name': 'sfSpan'}]","[{'name': 'glocations', 'value': 'France', 'rank': 1, 'major': 'N'}, {'name': 'persons', 'value': 'Chirac, Jacques', 'rank': 2, 'major': 'N'}, {'name': 'subject', 'value': 'Frauds and Swindling', 'rank': 3, 'major': 'N'}, {'name': 'subject', 'value': 'Politics and Government', 'rank': 4, 'major': 'N'}]",2011-09-05T16:59:19+0000,article,Foreign,World,Europe,News,nyt://article/c5017d97-c9e9-5eef-b917-f6ea5764df84,765,nyt://article/c5017d97-c9e9-5eef-b917-f6ea5764df84,Chirac Trial to Go On Without Him,,,Chirac Trial to Go On Without Him,,,,By Steven Erlanger,"[{'firstname': 'Steven', 'middlename': None, 'lastname': 'Erlanger', 'qualifier': None, 'title': None, 'role': 'reported', 'organization': '', 'rank': 1}]",,Alzheimer,
"Dr. McCulloch was involved in the discovery of stem cells and thereby opening a path of research that some day may help treat a variety of serious, sometimes lethal, ailments.",https://www.nytimes.com/2011/02/01/health/research/01mcculloch.html,"Dr. McCulloch was involved in the discovery of stem cells and thereby opening a path of research that some day may help treat a variety of serious, sometimes lethal, ailments.","Dr. Ernest A. McCulloch, a father of the stem cell research that scientists say holds promise for the treatment of many ailments, died on Jan. 20 in Toronto. He was 84.",B,19,The New York Times,"[{'rank': 0, 'subtype': 'jumbo', 'caption': None, 'credit': None, 'type': 'image', 'url': 'images/2011/02/01/science/01mccul/01mccul-jumbo.jpg', 'height': 1024, 'width': 715, 'legacy': {}, 'subType': 'jumbo', 'crop_name': 'jumbo'}, {'rank': 0, 'subtype': 'popup', 'caption': None, 'credit': None, 'type': 'image', 'url': 'images/2011/02/01/science/01mccul/01mccul-popup.jpg', 'height': 500, 'width': 349, 'legacy': {}, 'subType': 'popup', 'crop_name': 'popup'}, {'rank': 0, 'subtype': 'articleInline', 'caption': None, 'credit': None, 'type': 'image', 'url': 'images/2011/02/01/science/01mccul/01mccul-articleInline.jpg', 'height': 272, 'width': 190, 'legacy': {}, 'subType': 'articleInline', 'crop_name': 'articleInline'}, {'rank': 0, 'subtype': 'thumbnail', 'caption': None, 'credit': None, 'type': 'image', 'url': 'images/2011/02/01/science/01mccul/01mccul-thumbStandard.jpg', 'height': 75, 'width': 75, 'legacy': {'thumbnail': 'images/2011/02/01/science/01mccul/01mccul-thumbStandard.jpg', 'thumbnailwidth': 75, 'thumbnailheight': 75}, 'subType': 'thumbnail', 'crop_name': 'thumbStandard'}]","[{'name': 'subject', 'value': 'Medicine and Health', 'rank': 1, 'major': 'N'}, {'name': 'subject', 'value': 'Stem Cells (Embryonic)', 'rank': 2, 'major': 'N'}, {'name': 'subject', 'value': 'Research', 'rank': 3, 'major': 'N'}, {'name': 'subject', 'value': 'Deaths (Obituaries)', 'rank': 4, 'major': 'N'}]",2011-02-01T06:42:02+0000,article,National,Health,Research,Obituary (Obit),nyt://article/67f6d3ed-56a9-567f-9f27-b0d0912c7113,742,nyt://article/67f6d3ed-56a9-567f-9f27-b0d0912c7113,"Ernest McCulloch, Crucial Figure in Stem Cell Research, Dies at 84",,,"Ernest McCulloch, 84, Stem Cell Research Pioneer, Dies",,,,By Lawrence K. Altman,"[{'firstname': 'Lawrence', 'middlename': 'K.', 'lastname': 'Altman', 'qualifier': None, 'title': None, 'role': 'reported', 'organization': '', 'rank': 1}]",,Alzheimer,
Mr. Sigoloff was a corporate turnaround expert who called himself the “Skillful Scalpel” as he sought to preserve the value in failing companies.,https://www.nytimes.com/2011/02/25/business/25sigoloff.html,Mr. Sigoloff was a corporate turnaround expert who called himself the “Skillful Scalpel” as he sought to preserve the value in failing companies.,"Sanford C. Sigoloff, a corporate turnaround expert who called himself the Skillful Scalpel as he sought to preserve the value in failing companies, died on Saturday at his home in Brentwood, Calif. He was 80.",B,14,The New York Times,"[{'rank': 0, 'subtype': 'jumbo', 'caption': None, 'credit': None, 'type': 'image', 'url': 'images/2011/02/25/business/SIGOLOFF-obit/SIGOLOFF-obit-jumbo.jpg', 'height': 1024, 'width': 709, 'legacy': {}, 'subType': 'jumbo', 'crop_name': 'jumbo'}, {'rank': 0, 'subtype': 'popup', 'caption': None, 'credit': None, 'type': 'image', 'url': 'images/2011/02/25/business/SIGOLOFF-obit/SIGOLOFF-obit-popup.jpg', 'height': 500, 'width': 346, 'legacy': {}, 'subType': 'popup', 'crop_name': 'popup'}, {'rank': 0, 'subtype': 'articleInline', 'caption': None, 'credit': None, 'type': 'image', 'url': 'images/2011/02/25/business/SIGOLOFF-obit/SIGOLOFF-obit-articleInline.jpg', 'height': 275, 'width': 190, 'legacy': {}, 'subType': 'articleInline', 'crop_name': 'articleInline'}, {'rank': 0, 'subtype': 'thumbnail', 'caption': None, 'credit': None, 'type': 'image', 'url': 'images/2011/02/25/business/SIGOLOFF-obit/SIGOLOFF-obit-thumbStandard.jpg', 'height': 75, 'width': 75, 'legacy': {'thumbnail': 'images/2011/02/25/business/SIGOLOFF-obit/SIGOLOFF-obit-thumbStandard.jpg', 'thumbnailwidth': 75, 'thumbnailheight': 75}, 'subType': 'thumbnail', 'crop_name': 'thumbStandard'}]","[{'name': 'subject', 'value': 'Shopping and Retail', 'rank': 1, 'major': 'N'}, {'name': 'subject', 'value': 'Executives and Management', 'rank': 2, 'major': 'N'}, {'name': 'subject', 'value': 'Deaths (Obituaries)', 'rank': 3, 'major': 'N'}]",2011-02-25T01:47:50+0000,article,Business,Business Day,,Obituary (Obit),nyt://article/a00ff0fc-b2fa-588f-8542-512bc7a5205f,752,nyt://article/a00ff0fc-b2fa-588f-8542-512bc7a5205f,"Sanford C. Sigoloff, Corporate Turnaround Expert, Dies at 80",,,"Sanford Sigoloff, 80, Expert at Turnarounds",,,,By Mary Williams Walsh,"[{'firstname': 'Mary', 'middlename': 'Williams', 'lastname': 'Walsh', 'qualifier': None, 'title': None, 'role': 'reported', 'organization': '', 'rank': 1}]",,Alzheimer,
"At a recent conference, health care professionals, artists and humanities scholars discussed how comics could be used in medical education, patient care and scholarship.",https://www.nytimes.com/2011/06/17/us/17cncwarren.html,"At a recent conference, health care professionals, artists and humanities scholars discussed how comics could be used in medical education, patient care and scholarship.",James Warren is a columnist for the Chicago News Cooperative. ,A,29A,The New York Times,"[{'rank': 0, 'subtype': 'blog480', 'caption': None, 'credit': None, 'type': 'image', 'url': 'images/2011/06/17/us/17CNCWARREN/17CNCWARREN-blog480.jpg', 'height': 465, 'width': 480, 'legacy': {}, 'subType': 'blog480', 'crop_name': 'blog480'}, {'rank': 0, 'subtype': 'jumbo', 'caption': None, 'credit': None, 'type': 'image', 'url': 'images/2011/06/17/us/17CNCWARREN/17CNCWARREN-jumbo.jpg', 'height': 993, 'width': 1024, 'legacy': {}, 'subType': 'jumbo', 'crop_name': 'jumbo'}, {'rank': 0, 'subtype': 'popup', 'caption': None, 'credit': None, 'type': 'image', 'url': 'images/2011/06/17/us/17CNCWARREN/17CNCWARREN-popup.jpg', 'height': 630, 'width': 650, 'legacy': {}, 'subType': 'popup', 'crop_name': 'popup'}, {'rank': 0, 'subtype': 'articleInline', 'caption': None, 'credit': None, 'type': 'image', 'url': 'images/2011/06/17/us/17CNCWARREN/17CNCWARREN-articleInline.jpg', 'height': 184, 'width': 190, 'legacy': {}, 'subType': 'articleInline', 'crop_name': 'articleInline'}]","[{'name': 'glocations', 'value': 'Illinois', 'rank': 1, 'major': 'N'}, {'name': 'subject', 'value': 'Medicine and Health', 'rank': 2, 'major': 'N'}, {'name': 'subject', 'value': 'Comic Books and Strips', 'rank': 3, 'major': 'N'}, {'name': 'subject', 'value': 'Nursing and Nurses', 'rank': 4, 'major': 'N'}]",2011-06-17T04:05:54+0000,article,National,U.S.,,News,nyt://article/2854ec8c-5502-5e76-a61f-f834fc2c097d,763,nyt://article/2854ec8c-5502-5e76-a61f-f834fc2c097d,A New Therapeutic Tool in the Doctor’s Bag: Comic Strips,Chicago News Cooperative,,A New Therapeutic Tool in the Doctor’s Bag: Comic Strips,,,,By James Warren,"[{'firstname': 'James', 'middlename': None, 'lastname': 'Warren', 'qualifier': None, 'title': None, 'role': 'reported', 'organization': '', 'rank': 1}]",,Alzheimer,
Several Web sites have been created to review and maintain lists of apps aimed at helping children with autism and other special needs.,https://gadgetwise.blogs.nytimes.com/2011/11/29/finding-good-apps-for-children-with-autism/,Several Web sites have been created to review and maintain lists of apps aimed at helping children with autism and other special needs.,The Apple iPad has been hailed as a savior for assisting children with autism spectrum disorder or other special needs. It was portrayed as a minor miracle in a recent segment on “60 Minutes” and has been found to help even the very young quickly learn.,,,The New York Times,[],"[{'name': 'subject', 'value': 'Android (Operating System)', 'rank': 1, 'major': 'N'}, {'name': 'subject', 'value': 'Autism', 'rank': 2, 'major': 'N'}, {'name': 'subject', 'value': 'iPad', 'rank': 3, 'major': 'N'}, {'name': 'subject', 'value': 'Mobile Applications', 'rank': 4, 'major': 'N'}, {'name': 'subject', 'value': 'Special Education', 'rank': 5, 'major': 'N'}, {'name': 'organizations', 'value': 'Apple Incorporated', 'rank': 6, 'major': 'N'}]",2011-11-29T16:47:23+0000,article,,Technology,Personal Tech,News,nyt://article/41e2c743-f356-55f6-875e-e3b25ff7eb4e,761,nyt://article/41e2c743-f356-55f6-875e-e3b25ff7eb4e,Finding Good Apps for Children With Autism,Gadgetwise,,,,,,By Pradnya Joshi,"[{'firstname': 'Pradnya', 'middlename': None, 'lastname': 'Joshi', 'qualifier': None, 'title': None, 'role': 'reported', 'organization': '', 'rank': 1}]",,Alzheimer,
"City Hall unveils a new budget, the University of Chicago economists ponder, and the unemployed try and try and try again.",https://www.nytimes.com/2011/10/14/us/the-unemployed-dont-care-whether-its-structural-or-cyclical.html,"City Hall unveils a new budget, the University of Chicago economists ponder, and the unemployed try and try and try again.",James Warren writes a column for the Chicago News Cooperative.,A,21A,The New York Times,[],"[{'name': 'subject', 'value': 'Unemployment', 'rank': 1, 'major': 'N'}, {'name': 'subject', 'value': 'Economic Conditions and Trends', 'rank': 2, 'major': 'N'}, {'name': 'persons', 'value': 'Emanuel, Rahm', 'rank': 3, 'major': 'N'}, {'name': 'glocations', 'value': 'Chicago (Ill)', 'rank': 4, 'major': 'N'}]",2011-10-14T04:02:53+0000,article,National,U.S.,,News,nyt://article/d7faf5e8-51e2-55fb-9dd5-9f8103ea9d40,749,nyt://article/d7faf5e8-51e2-55fb-9dd5-9f8103ea9d40,The Unemployed Don’t Care Whether It’s Structural or Cyclical,Chicago News Cooperative,,The Unemployed Don’t Care Whether It’s Structural or Cyclical,,,,By James Warren,"[{'firstname': 'James', 'middlename': None, 'lastname': 'Warren', 'qualifier': None, 'title': None, 'role': 'reported', 'organization': '', 'rank': 1}]",,Alzheimer,
Ms. Fickett was well known to viewers of “All My Children” and received a Tony nomination for her role as Eleanor Roosevelt in the play “Sunrise at Campobello.”,https://www.nytimes.com/2011/09/13/arts/television/mary-fickett-a-pillar-of-all-my-children-dies-at-83.html,Ms. Fickett was well known to viewers of “All My Children” and received a Tony nomination for her role as Eleanor Roosevelt in the play “Sunrise at Campobello.”,"Mary Fickett, who acted in theater, film and prime-time television before becoming a legend among followers of the daytime drama “All My Children” as Ruth Martin, a nurse unafraid to speak her mind, died on Thursday at her home in Callao, Va. She was 83. ",B,19,The New York Times,"[{'rank': 0, 'subtype': 'jumbo', 'caption': None, 'credit': None, 'type': 'image', 'url': 'images/2011/09/13/arts/FICKETT1-obit/FICKETT1-obit-jumbo.jpg', 'height': 1024, 'width': 709, 'legacy': {}, 'subType': 'jumbo', 'crop_name': 'jumbo'}, {'rank': 0, 'subtype': 'popup', 'caption': None, 'credit': None, 'type': 'image', 'url': 'images/2011/09/13/arts/FICKETT1-obit/FICKETT1-obit-popup.jpg', 'height': 500, 'width': 346, 'legacy': {}, 'subType': 'popup', 'crop_name': 'popup'}, {'rank': 0, 'subtype': 'articleInline', 'caption': None, 'credit': None, 'type': 'image', 'url': 'images/2011/09/13/arts/FICKETT1-obit/FICKETT1-obit-articleInline.jpg', 'height': 275, 'width': 190, 'legacy': {}, 'subType': 'articleInline', 'crop_name': 'articleInline'}, {'rank': 0, 'subtype': 'thumbnail', 'caption': None, 'credit': None, 'type': 'image', 'url': 'images/2011/09/13/arts/FICKETT1-obit/FICKETT1-obit-thumbStandard.jpg', 'height': 75, 'width': 75, 'legacy': {'thumbnail': 'images/2011/09/13/arts/FICKETT1-obit/FICKETT1-obit-thumbStandard.jpg', 'thumbnailwidth': 75, 'thumbnailheight': 75}, 'subType': 'thumbnail', 'crop_name': 'thumbStandard'}]","[{'name': 'subject', 'value': 'Deaths (Obituaries)', 'rank': 1, 'major': 'N'}, {'name': 'persons', 'value': 'Fickett, Mary', 'rank': 2, 'major': 'N'}, {'name': 'subject', 'value': 'Television', 'rank': 3, 'major': 'N'}]",2011-09-12T23:58:48+0000,article,Culture,Arts,Television,Obituary (Obit),nyt://article/a3a02f61-47a3-5417-8ba4-596c0cb83329,729,nyt://article/a3a02f61-47a3-5417-8ba4-596c0cb83329,"Mary Fickett, a Pillar of ‘All My Children,’ Dies at 83",,,"Mary Fickett, a Pillar of ‘All My Children,’ Dies at 83",,,,By Douglas Martin,"[{'firstname': 'Douglas', 'middlename': None, 'lastname': 'Martin', 'qualifier': None, 'title': None, 'role': 'reported', 'organization': '', 'rank': 1}]",,Alzheimer,
Debating sex selection and abortion with the author of “Unnatural Selection”,https://douthat.blogs.nytimes.com/2011/07/01/a-response-to-mara-hvistendahl-i/,Debating sex selection and abortion with the author of “Unnatural Selection”,"The author of “Unnatural Selection” has kindly written a reply to my column on her book. Not surprisingly, she takes exception to my suggestion that sex-selective abortion poses a problem for pro-choice liberals, arguing that there’s no contradiction at all between supporting abortion rights and trying to restrict/ban abortions based on sex:",,,The New York Times,[],[],2011-07-01T14:44:50+0000,article,,Opinion,,News,nyt://article/0c70207b-f9fd-5022-b4bf-07936cb2fe8d,815,nyt://article/0c70207b-f9fd-5022-b4bf-07936cb2fe8d,A Response to Mara Hvistendahl (I),Ross Douthat,,,,,,By Ross Douthat,"[{'firstname': 'Ross', 'middlename': None, 'lastname': 'Douthat', 'qualifier': None, 'title': None, 'role': 'reported', 'organization': '', 'rank': 1}]",,Alzheimer,
"A Google team’s self-driving cars have traveled nearly 200,000 miles on public highways in California and Nevada, 100 percent safely.",https://www.nytimes.com/2011/12/06/science/sebastian-thrun-self-driving-cars-can-save-lives-and-parking-spaces.html,"A Google team’s self-driving cars have traveled nearly 200,000 miles on public highways in California and Nevada, 100 percent safely.","The Jetsons had them in the 1960s. They were the defining element of “Knight Rider” in the 1980s: cars that drive themselves. Self-driving cars appear in countless science fiction movies. By Hollywood standards, they are so normal we don’t even notice them. ",D,4,The New York Times,"[{'rank': 0, 'subtype': 'jumbo', 'caption': None, 'credit': None, 'type': 'image', 'url': 'images/2011/12/06/science/06HEAD1/06HEAD1-jumbo.jpg', 'height': 1024, 'width': 851, 'legacy': {}, 'subType': 'jumbo', 'crop_name': 'jumbo'}, {'rank': 0, 'subtype': 'popup', 'caption': None, 'credit': None, 'type': 'image', 'url': 'images/2011/12/06/science/06HEAD1/06HEAD1-popup.jpg', 'height': 500, 'width': 416, 'legacy': {}, 'subType': 'popup', 'crop_name': 'popup'}, {'rank': 0, 'subtype': 'articleInline', 'caption': None, 'credit': None, 'type': 'image', 'url': 'images/2011/12/06/science/06HEAD1/06HEAD1-articleInline.jpg', 'height': 229, 'width': 190, 'legacy': {}, 'subType': 'articleInline', 'crop_name': 'articleInline'}, {'rank': 0, 'subtype': 'thumbnail', 'caption': None, 'credit': None, 'type': 'image', 'url': 'images/2011/12/06/science/06HEAD1/06HEAD1-thumbStandard.jpg', 'height': 75, 'width': 75, 'legacy': {'thumbnail': 'images/2011/12/06/science/06HEAD1/06HEAD1-thumbStandard.jpg', 'thumbnailwidth': 75, 'thumbnailheight': 75}, 'subType': 'thumbnail', 'crop_name': 'thumbStandard'}]","[{'name': 'subject', 'value': 'Roads and Traffic', 'rank': 1, 'major': 'N'}, {'name': 'organizations', 'value': 'Google Inc', 'rank': 2, 'major': 'N'}, {'name': 'subject', 'value': 'Traffic Accidents and Safety', 'rank': 3, 'major': 'N'}, {'name': 'subject', 'value': 'Computers and the Internet', 'rank': 4, 'major': 'N'}, {'name': 'subject', 'value': 'Automobiles', 'rank': 5, 'major': 'N'}]",2011-12-05T21:27:58+0000,article,Science,Science,,News,nyt://article/308a542c-b079-5c4a-abdc-6da39b909536,710,nyt://article/308a542c-b079-5c4a-abdc-6da39b909536,"Leave the Driving to the Car, and Reap Benefits in Safety and Mobility",Essay,,"Leave the Driving to the Car, and Reap Benefits in Safety and Mobility",,,,By Sebastian Thrun,"[{'firstname': 'Sebastian', 'middlename': None, 'lastname': 'Thrun', 'qualifier': None, 'title': None, 'role': 'reported', 'organization': '', 'rank': 1}]",,Alzheimer,
"Sportswriters examined 49ers Coach Jim Harbaugh’s overzealous postgame handshake, and Lions Coach Jim Schwartz’s reaction to it.",https://www.nytimes.com/2011/10/18/sports/much-ado-about-handshake-after-49ers-lions-game-leading-off.html,"Sportswriters examined 49ers Coach Jim Harbaugh’s overzealous postgame handshake, and Lions Coach Jim Schwartz’s reaction to it.","Today’s talk will, of course, be all about the handshake. When 49ers Coach Jim Harbaugh grabbed Lions Coach Jim Schwartz’s hand and gave him an overzealous jerk, prompting Schwartz to chase him down maniacally as they left the field Sunday, it became the perfect sports story for this era. It’s easy to argue about, was captured fully on video that can be replayed endlessly and is entirely silly. It had no impact on how the game turned out, much less anything deeper or more meaningful. Which means it will be debated until the N.F.L. can provide you another distraction. (Tim Tebow is starting next week!)",,,The New York Times,"[{'rank': 0, 'subtype': 'xlarge', 'caption': None, 'credit': None, 'type': 'image', 'url': 'images/2011/10/18/sports/football/18leading-pic2/18leading-pic2-articleLarge.jpg', 'height': 315, 'width': 600, 'legacy': {'xlarge': 'images/2011/10/18/sports/football/18leading-pic2/18leading-pic2-articleLarge.jpg', 'xlargewidth': 600, 'xlargeheight': 315}, 'subType': 'xlarge', 'crop_name': 'articleLarge'}, {'rank': 0, 'subtype': 'blog480', 'caption': None, 'credit': None, 'type': 'image', 'url': 'images/2011/10/18/sports/football/18leading-pic2/18leading-pic2-blog480.jpg', 'height': 332, 'width': 480, 'legacy': {}, 'subType': 'blog480', 'crop_name': 'blog480'}, {'rank': 0, 'subtype': 'jumbo', 'caption': None, 'credit': None, 'type': 'image', 'url': 'images/2011/10/18/sports/football/18leading-pic2/18leading-pic2-jumbo.jpg', 'height': 709, 'width': 1024, 'legacy': {}, 'subType': 'jumbo', 'crop_name': 'jumbo'}, {'rank': 0, 'subtype': 'popup', 'caption': None, 'credit': None, 'type': 'image', 'url': 'images/2011/10/18/sports/football/18leading-pic2/18leading-pic2-popup.jpg', 'height': 450, 'width': 650, 'legacy': {}, 'subType': 'popup', 'crop_name': 'popup'}, {'rank': 0, 'subtype': 'articleInline', 'caption': None, 'credit': None, 'type': 'image', 'url': 'images/2011/10/18/sports/football/18leading-pic2/18leading-pic2-articleInline.jpg', 'height': 132, 'width': 190, 'legacy': {}, 'subType': 'articleInline', 'crop_name': 'articleInline'}, {'rank': 0, 'subtype': 'sfSpan', 'caption': None, 'credit': None, 'type': 'image', 'url': 'images/2011/10/18/sports/football/18leading-pic2/18leading-pic2-sfSpan.jpg', 'height': 273, 'width': 395, 'legacy': {}, 'subType': 'sfSpan', 'crop_name': 'sfSpan'}, {'rank': 0, 'subtype': 'thumbnail', 'caption': None, 'credit': None, 'type': 'image', 'url': 'images/2011/10/18/sports/football/18leading-pic2/18leading-pic2-thumbStandard.jpg', 'height': 75, 'width': 75, 'legacy': {'thumbnail': 'images/2011/10/18/sports/football/18leading-pic2/18leading-pic2-thumbStandard.jpg', 'thumbnailwidth': 75, 'thumbnailheight': 75}, 'subType': 'thumbnail', 'crop_name': 'thumbStandard'}]","[{'name': 'subject', 'value': 'Football', 'rank': 1, 'major': 'N'}, {'name': 'subject', 'value': 'Baseball', 'rank': 2, 'major': 'N'}, {'name': 'subject', 'value': 'Automobile Racing', 'rank': 3, 'major': 'N'}, {'name': 'organizations', 'value': 'Milwaukee Brewers', 'rank': 4, 'major': 'N'}, {'name': 'organizations', 'value': 'Dallas Cowboys', 'rank': 5, 'major': 'N'}, {'name': 'organizations', 'value': 'Detroit Lions', 'rank': 6, 'major': 'N'}, {'name': 'organizations', 'value': 'St Louis Cardinals', 'rank': 7, 'major': 'N'}, {'name': 'organizations', 'value': 'San Francisco 49ers', 'rank': 8, 'major': 'N'}, {'name': 'persons', 'value': 'Wheldon, Dan', 'rank': 9, 'major': 'N'}, {'name': 'persons', 'value': 'Garrett, Jason', 'rank': 10, 'major': 'N'}, {'name': 'persons', 'value': 'Romo, Tony', 'rank': 11, 'major': 'N'}, {'name': 'persons', 'value': 'Harbaugh, Jim', 'rank': 12, 'major': 'N'}, {'name': 'persons', 'value': 'Tebow, Tim', 'rank': 13, 'major': 'N'}, {'name': 'persons', 'value': 'Schwartz, Jim (1966- )', 'rank': 14, 'major': 'N'}]",2011-10-17T15:23:57+0000,article,Sports,Sports,,News,nyt://article/75c99b07-4ebc-5cb0-84d5-ed9a792579ea,708,nyt://article/75c99b07-4ebc-5cb0-84d5-ed9a792579ea,Much Ado About a Handshake,Leading Off,,Much Ado About a Handshake,,,,By Lynn Zinser,"[{'firstname': 'Lynn', 'middlename': None, 'lastname': 'Zinser', 'qualifier': None, 'title': None, 'role': 'reported', 'organization': '', 'rank': 1}]",,Alzheimer,
