abstract,web_url,snippet,lead_paragraph,print_section,print_page,source,multimedia,keywords,pub_date,document_type,news_desk,section_name,type_of_material,_id,word_count,uri,headline.main,headline.kicker,headline.content_kicker,headline.print_headline,headline.name,headline.seo,headline.sub,byline.original,byline.person,byline.organization,query_consulta,subsection_name
"Nursing homes for first time are checking immigration status of applicants for admission, and they expect to exclude many elderly immigrants who will become ineligible for Medicaid because of new welfare law (M)",https://www.nytimes.com/1996/10/13/us/under-new-law-nursing-homes-might-reject-legal-immigrants.html,"Nursing homes for first time are checking immigration status of applicants for admission, and they expect to exclude many elderly immigrants who will become ineligible for Medicaid because of new welfare law (M)","For the first time, nursing homes are checking the immigration status of applicants for admission, and they expect to exclude many elderly immigrants who will become ineligible for Medicaid because of the new welfare law.",1,24,The New York Times,[],"[{'name': 'glocations', 'value': 'United States', 'rank': 1, 'major': 'N'}, {'name': 'subject', 'value': 'IMMIGRATION AND REFUGEES', 'rank': 2, 'major': 'N'}, {'name': 'subject', 'value': 'Welfare (US)', 'rank': 3, 'major': 'N'}, {'name': 'subject', 'value': 'Medicaid', 'rank': 4, 'major': 'N'}, {'name': 'subject', 'value': 'AGED', 'rank': 5, 'major': 'N'}, {'name': 'subject', 'value': 'Law and Legislation', 'rank': 6, 'major': 'N'}, {'name': 'subject', 'value': 'Nursing Homes', 'rank': 7, 'major': 'N'}]",1996-10-13T05:00:00+0000,article,National Desk,U.S.,News,nyt://article/be13f8ec-788b-534e-b047-2097e5b31bb7,1120,nyt://article/be13f8ec-788b-534e-b047-2097e5b31bb7,"Under New Law, Nursing Homes Might Reject Legal Immigrants",,,"Under New Law, Nursing Homes Might Reject Legal Immigrants",,,,By Robert Pear,"[{'firstname': 'Robert', 'middlename': None, 'lastname': 'Pear', 'qualifier': None, 'title': None, 'role': 'reported', 'organization': '', 'rank': 1}]",,Alzheimer,
Roc Ordman receives patent for vitamin C supplement of 500 milligrams taken twice a day; Ordman says his research showed that dosage was amount body can best absorb and retain; Neose Technologies Inc and Rockefeller University receive patent for method of producing enzymes used to string chains of carbohydrates together to add to food or administer as drugs and bolster immune system; Andrew Dibner receives patent for device that answers phone and diverts call to answering machine or fax before bell chimes (M),https://www.nytimes.com/1996/10/07/business/with-winter-whisper-away-question-much-vitamin-c-should-person-take-each-day.html,Roc Ordman receives patent for vitamin C supplement of 500 milligrams taken twice a day; Ordman says his research showed that dosage was amount body can best absorb and retain; Neose Technologies Inc and Rockefeller University receive patent for m...,"AN vitamin C prevent colds? Protect against cancer? Reduce the risk of Alzheimer's? If so, how much should a person take, and how often? For how long?",D,2,The New York Times,[],"[{'name': 'organizations', 'value': 'Rockefeller University', 'rank': 1, 'major': 'N'}, {'name': 'organizations', 'value': 'NEOSE TECHNOLOGIES INC', 'rank': 2, 'major': 'N'}, {'name': 'persons', 'value': 'Dibner, Andrew', 'rank': 3, 'major': 'N'}, {'name': 'persons', 'value': 'Ordman, Roc', 'rank': 4, 'major': 'N'}, {'name': 'subject', 'value': 'Vitamins', 'rank': 5, 'major': 'N'}, {'name': 'subject', 'value': 'Carbohydrates', 'rank': 6, 'major': 'N'}, {'name': 'subject', 'value': 'ENZYMES', 'rank': 7, 'major': 'N'}, {'name': 'subject', 'value': 'Vitamin C', 'rank': 8, 'major': 'N'}, {'name': 'subject', 'value': 'Immune System', 'rank': 9, 'major': 'N'}, {'name': 'subject', 'value': 'Inventions and Patents', 'rank': 10, 'major': 'N'}, {'name': 'subject', 'value': 'Telephones and Telecommunications', 'rank': 11, 'major': 'N'}]",1996-10-07T05:00:00+0000,article,Business/Financial Desk,Business Day,News,nyt://article/74b0ab2f-86ae-55fb-af8a-48a917f8b09f,1068,nyt://article/74b0ab2f-86ae-55fb-af8a-48a917f8b09f,"With winter a whisper away, the question is how much vitamin C should a person take each day?",Patents,,"With winter a whisper away, the question is how much vitamin C should a person take each day?",,,,By Sabra Chartrand,"[{'firstname': 'Sabra', 'middlename': None, 'lastname': 'Chartrand', 'qualifier': None, 'title': None, 'role': 'reported', 'organization': '', 'rank': 1}]",,Alzheimer,
"Family values"" was the flag that Joseph Waldholtz tirelessly waved in 1994 to help elect his wife, Enid Greene Waldholtz, to Congress in the most expensive campaign of the season.         Once in Congress, Representative Waldholtz, a Republican, carried that flag further by turning a baby shower for their daughter into a $500-a-head fund raiser.   ",https://www.nytimes.com/1996/04/19/us/utah-couple-playing-out-family-saga.html,,"Family values"" was the flag that Joseph Waldholtz tirelessly waved in 1994 to help elect his wife, Enid Greene Waldholtz, to Congress in the most expensive campaign of the season.",A,14,The New York Times,[],"[{'name': 'glocations', 'value': 'United States', 'rank': 1, 'major': 'N'}, {'name': 'glocations', 'value': 'Utah', 'rank': 2, 'major': 'N'}, {'name': 'organizations', 'value': 'CONGRESS', 'rank': 3, 'major': 'N'}, {'name': 'organizations', 'value': 'House of Representatives', 'rank': 4, 'major': 'N'}, {'name': 'persons', 'value': 'WALDHOLTZ, JOE', 'rank': 5, 'major': 'N'}, {'name': 'persons', 'value': 'Waldholtz, Enid Greene', 'rank': 6, 'major': 'N'}, {'name': 'subject', 'value': 'Embezzlement', 'rank': 7, 'major': 'N'}, {'name': 'subject', 'value': 'Finances', 'rank': 8, 'major': 'N'}, {'name': 'subject', 'value': 'Biographical Information', 'rank': 9, 'major': 'N'}, {'name': 'subject', 'value': 'Ethics', 'rank': 10, 'major': 'N'}, {'name': 'subject', 'value': 'Elections', 'rank': 11, 'major': 'N'}]",1996-04-19T05:00:00+0000,article,National Desk,U.S.,News,nyt://article/1a033f2a-2997-55c4-84f5-f11b8fde60b8,1046,nyt://article/1a033f2a-2997-55c4-84f5-f11b8fde60b8,Utah Couple Playing Out Family Saga,,,Utah Couple Playing Out Family Saga,,,,By James Brooke,"[{'firstname': 'James', 'middlename': None, 'lastname': 'Brooke', 'qualifier': None, 'title': None, 'role': 'reported', 'organization': '', 'rank': 1}]",,Alzheimer,
"TO help keep more elderly people on Long Island, the Town of North Hempstead  is planning a ""life care community"" in Port Washington. The center would be the  first of its type in Nassau County.         Life-care plans are like insurance policies. They cover housing, services, amenities and health care, including long-term care, at one site.   ",https://www.nytimes.com/1996/05/19/nyregion/life-care-community-planned-for-the-elderly.html,,"TO help keep more elderly people on Long Island, the Town of North Hempstead is planning a ""life care community"" in Port Washington. The center would be the first of its type in Nassau County.",LI,13,The New York Times,[],"[{'name': 'glocations', 'value': 'Port Washington (NY)', 'rank': 1, 'major': 'N'}, {'name': 'glocations', 'value': 'Long Island (NY)', 'rank': 2, 'major': 'N'}, {'name': 'glocations', 'value': 'NASSAUCOUNTY (NY)', 'rank': 3, 'major': 'N'}, {'name': 'glocations', 'value': 'NORTH HEMPSTEAD (NY)', 'rank': 4, 'major': 'N'}, {'name': 'subject', 'value': 'AGED', 'rank': 5, 'major': 'N'}]",1996-05-19T05:00:00+0000,article,Long Island Weekly Desk,New York,News,nyt://article/03fcafd7-e614-522d-856f-9d9faf183769,1165,nyt://article/03fcafd7-e614-522d-856f-9d9faf183769,Life-Care Community Planned for the Elderly,,,Life-Care Community Planned for the Elderly,,,,By Linda Saslow,"[{'firstname': 'Linda', 'middlename': None, 'lastname': 'Saslow', 'qualifier': None, 'title': None, 'role': 'reported', 'organization': '', 'rank': 1}]",,Alzheimer,
"This summer, in the course of research into my family's genetic history, I traveled into the heart of a largely unmapped landscape: the human genome, the tightly wound coils of DNA that form each one of us. 

     Laid end to end, the coils would form a strand six feet long, bearing data that could fill 13 sets of encyclopedias. Along this strand, only random stretches of DNA, maybe 5 percent of the entire genome, are known to be engaged  in the intricate processes that shape our existence. These isolated DNA bits are the genes. There are an estimated 100,000 or so genes within each one of our cells.",https://www.nytimes.com/1996/01/05/opinion/at-the-mercy-of-our-genes.html,"This summer, in the course of research into my family's genetic history, I traveled into the heart of a largely unmapped landscape: the human genome, the tightly wound coils of DNA that form each one of us. 

     Laid end to end, the coils would ...","This summer, in the course of research into my family's genetic history, I traveled into the heart of a largely unmapped landscape: the human genome, the tightly wound coils of DNA that form each one of us. ",A,13,The New York Times,[],"[{'name': 'persons', 'value': 'Siebert, Charles', 'rank': 1, 'major': 'N'}, {'name': 'subject', 'value': 'Genetics and Heredity', 'rank': 2, 'major': 'N'}]",1996-01-05T05:00:00+0000,article,Editorial Desk,Opinion,Op-Ed,nyt://article/2fd4d54e-2406-5332-ac67-62351f1b2921,1270,nyt://article/2fd4d54e-2406-5332-ac67-62351f1b2921,At the Mercy Of Our Genes,,,At the Mercy Of Our Genes,,,,By Charles Siebert,"[{'firstname': 'Charles', 'middlename': None, 'lastname': 'Siebert', 'qualifier': None, 'title': None, 'role': 'reported', 'organization': '', 'rank': 1}]",,Alzheimer,
San Diego Diary column discusses scene in San Diego as city prepares for Republican National Convention; photo (M),https://www.nytimes.com/1996/08/12/us/for-one-true-believer-reagan-looms-large.html,San Diego Diary column discusses scene in San Diego as city prepares for Republican National Convention; photo (M),"The convention hall was half-lit and chilled, poised in a rehearsal mood of desertion and anticipation, when Mike Deaver stood in the center aisle to stare with the eyes of a practiced expert at the empty podium and summon the spirit of his absent friend and master, Ronald Reagan.",B,5,The New York Times,[],"[{'name': 'glocations', 'value': 'San Diego (Calif)', 'rank': 1, 'major': 'N'}, {'name': 'subject', 'value': 'Conventions, National (US)', 'rank': 2, 'major': 'N'}, {'name': 'subject', 'value': 'Presidential Election of 1996', 'rank': 3, 'major': 'N'}]",1996-08-12T05:00:00+0000,article,National Desk,U.S.,News,nyt://article/107fc853-5c5a-582a-a35d-46352f9f48b9,1148,nyt://article/107fc853-5c5a-582a-a35d-46352f9f48b9,"For One True Believer, Reagan Looms Large",POLITICS: SAN DIEGO DIARY,,"For One True Believer, Reagan Looms Large",,,,By Francis X. Clines,"[{'firstname': 'Francis', 'middlename': 'X.', 'lastname': 'Clines', 'qualifier': None, 'title': None, 'role': 'reported', 'organization': '', 'rank': 1}]",,Alzheimer,
"In a announcement that took the $200 billion worldwide pharmaceuticals industry by surprise, two Swiss drug giants, Sandoz Ltd. and Ciba-Geigy Ltd., announced yesterday that they would merge, forming a biotechnology powerhouse that would be the world's second-largest pharmaceutical maker.         At first glance, one analyst put the value of the combined company at $62 billion, which would rank it as one of the largest mergers ever, if not the largest.   ",https://www.nytimes.com/1996/03/07/us/2-swiss-drug-giants-in-a-surprise-merger-to-be-2d-in-world.html,,"In a announcement that took the $200 billion worldwide pharmaceuticals industry by surprise, two Swiss drug giants, Sandoz Ltd. and Ciba-Geigy Ltd., announced yesterday that they would merge, forming a biotechnology powerhouse that would be the world's second-largest pharmaceutical maker.",A,1,The New York Times,[],"[{'name': 'organizations', 'value': 'Ciba-Geigy Ltd', 'rank': 1, 'major': 'N'}, {'name': 'organizations', 'value': 'NOVARTIS', 'rank': 2, 'major': 'N'}, {'name': 'organizations', 'value': 'SANDOZ PHARMACEUTICALS CORP', 'rank': 3, 'major': 'N'}, {'name': 'subject', 'value': 'Mergers, Acquisitions and Divestitures', 'rank': 4, 'major': 'N'}, {'name': 'subject', 'value': 'Drugs (Pharmaceuticals)', 'rank': 5, 'major': 'N'}]",1996-03-07T05:00:00+0000,article,National Desk,U.S.,News,nyt://article/69928c7c-4176-5479-9543-b686302497b9,1134,nyt://article/69928c7c-4176-5479-9543-b686302497b9,2 Swiss Drug Giants In a Surprise Merger To Be 2d in World,,,2 Swiss Drug Giants In a Surprise Merger To Be 2d in World,,,,By Glenn Collins,"[{'firstname': 'Glenn', 'middlename': None, 'lastname': 'Collins', 'qualifier': None, 'title': None, 'role': 'reported', 'organization': '', 'rank': 1}]",,Alzheimer,
"Comment on increase in housing accommodation known as assisted living, sometimes known as supportive independent living--generic term for housing for people, generally in their 80's or over, and usually single, who are still relatively healthy, but need supportive and social environment; scene at Westfield Court in Stamford, Conn, described (M)",https://www.nytimes.com/1996/11/24/realestate/assisted-living-is-coming-with-health-care-option.html,"Comment on increase in housing accommodation known as assisted living, sometimes known as supportive independent living--generic term for housing for people, generally in their 80's or over, and usually single, who are still relatively healthy, bu...","AT age 86, W. Howard Chase, a retired professor of international relations at the University of Connecticut, still travels extensively as a private consultant on business management.",9,7,The New York Times,[],"[{'name': 'glocations', 'value': 'Stamford (Conn)', 'rank': 1, 'major': 'N'}, {'name': 'subject', 'value': 'Housing', 'rank': 2, 'major': 'N'}, {'name': 'subject', 'value': 'AGED', 'rank': 3, 'major': 'N'}]",1996-11-24T05:00:00+0000,article,Real Estate Desk,Real Estate,News,nyt://article/d5e5889b-4e94-58d0-b21b-7bcb99a7fabb,1297,nyt://article/d5e5889b-4e94-58d0-b21b-7bcb99a7fabb,"Assisted Living Is Coming, With Health-Care Option",In the Region/Long Island,,"Assisted Living Is Coming, With Health-Care Option",,,,By Diana Shaman,"[{'firstname': 'Diana', 'middlename': None, 'lastname': 'Shaman', 'qualifier': None, 'title': None, 'role': 'reported', 'organization': '', 'rank': 1}]",,Alzheimer,
"A deep freeze swung into the Deep South today, bringing ice, snow and temperatures below, or barely above, zero to parts of Mississippi, Georgia and Alabama.         Even northern and central Florida were affected, with temperatures in the 20's leaving the state's $1.2 billion citrus industry hanging by an icy thread.  Citrus farmers sprayed their trees with water to produce an insulating cover of  ice, but high winds were frustrating many of them.   ",https://www.nytimes.com/1996/02/05/us/deep-freeze-grips-southern-states.html,,"A deep freeze swung into the Deep South today, bringing ice, snow and temperatures below, or barely above, zero to parts of Mississippi, Georgia and Alabama.",A,1,The New York Times,[],"[{'name': 'glocations', 'value': 'Mississippi', 'rank': 1, 'major': 'N'}, {'name': 'glocations', 'value': 'Southern States (US)', 'rank': 2, 'major': 'N'}, {'name': 'glocations', 'value': 'Tennessee', 'rank': 3, 'major': 'N'}, {'name': 'glocations', 'value': 'Georgia', 'rank': 4, 'major': 'N'}, {'name': 'glocations', 'value': 'North Carolina', 'rank': 5, 'major': 'N'}, {'name': 'glocations', 'value': 'Florida', 'rank': 6, 'major': 'N'}, {'name': 'glocations', 'value': 'Alabama', 'rank': 7, 'major': 'N'}, {'name': 'subject', 'value': 'BLACKOUTS (ELECTRICAL)', 'rank': 8, 'major': 'N'}, {'name': 'subject', 'value': 'Records and Achievements', 'rank': 9, 'major': 'N'}, {'name': 'subject', 'value': 'Weather', 'rank': 10, 'major': 'N'}, {'name': 'subject', 'value': 'CITRUSFRUITS', 'rank': 11, 'major': 'N'}, {'name': 'subject', 'value': 'Snow and Snowstorms', 'rank': 12, 'major': 'N'}, {'name': 'subject', 'value': 'Ice', 'rank': 13, 'major': 'N'}]",1996-02-05T05:00:00+0000,article,National Desk,U.S.,News,nyt://article/2d7a21f0-8fa0-5390-9aaa-9c2dcf8b5641,1243,nyt://article/2d7a21f0-8fa0-5390-9aaa-9c2dcf8b5641,DEEP FREEZE GRIPS SOUTHERN STATES,,,DEEP FREEZE GRIPS SOUTHERN STATES,,,,By Ronald Smothers,"[{'firstname': 'Ronald', 'middlename': None, 'lastname': 'Smothers', 'qualifier': None, 'title': None, 'role': 'reported', 'organization': '', 'rank': 1}]",,Alzheimer,
"Q. I bought a long-term care insurance policy in the 1980's, when you could only get nursing home coverage. Can I switch to a policy that also covers home care?         A. For many people in good health, it is not only possible but strongly recommended. The reasons are several: People are living longer and relying more on home care while the Government is threatening to cut back on such aid. So if you are over age 50 with a net worth of at least $250,000, it is time to start shopping around for a policy that includes home care. If you are worth less, the annual cost of additional coverage could be an overwhelming burden.   ",https://www.nytimes.com/1996/01/28/business/minding-your-business-why-and-when-home-care-insurance-is-needed.html,,"Q. I bought a long-term care insurance policy in the 1980's, when you could only get nursing home coverage. Can I switch to a policy that also covers home care?",3,9,The New York Times,[],"[{'name': 'subject', 'value': 'Home Health Care', 'rank': 1, 'major': 'N'}, {'name': 'subject', 'value': 'HEALTH INSURANCE', 'rank': 2, 'major': 'N'}, {'name': 'subject', 'value': 'Medicine and Health', 'rank': 3, 'major': 'N'}, {'name': 'subject', 'value': 'Nursing Homes', 'rank': 4, 'major': 'N'}]",1996-01-28T05:00:00+0000,article,Money and Business/Financial Desk,Business Day,Question,nyt://article/da660e03-1180-5a81-a775-50e40997cc2e,1201,nyt://article/da660e03-1180-5a81-a775-50e40997cc2e,"MINDING YOUR BUSINESS;Why, and When, Home Care Insurance Is Needed",MINDING YOUR BUSINESS,,"MINDING YOUR BUSINESS;Why, and When, Home Care Insurance Is Needed",,,,By Laura Pedersen,"[{'firstname': 'Laura', 'middlename': None, 'lastname': 'Pedersen', 'qualifier': None, 'title': None, 'role': 'reported', 'organization': '', 'rank': 1}]",,Alzheimer,
