abstract,web_url,snippet,lead_paragraph,print_section,print_page,source,multimedia,keywords,pub_date,document_type,news_desk,section_name,subsection_name,type_of_material,_id,word_count,uri,headline.main,headline.kicker,headline.content_kicker,headline.print_headline,headline.name,headline.seo,headline.sub,byline.original,byline.person,byline.organization,query_consulta,slideshow_credits
"Her son, Anthony D. Marshall, and Francis X. Morrissey Jr. were found guilty of defrauding Mrs. Astor, a victim of Alzheimer’s disease.",https://www.nytimes.com/2011/03/29/nyregion/29astor.html,"Her son, Anthony D. Marshall, and Francis X. Morrissey Jr. were found guilty of defrauding Mrs. Astor, a victim of Alzheimer’s disease.",The lawyers for Brooke Astor’s son and for a lawyer who did estate planning for her filed a lengthy appeal to their convictions on Monday.,A,29,The New York Times,[],"[{'name': 'persons', 'value': 'Astor, Brooke', 'rank': 1, 'major': 'N'}, {'name': 'persons', 'value': 'Morrissey, Francis X Jr', 'rank': 2, 'major': 'N'}, {'name': 'subject', 'value': 'Frauds and Swindling', 'rank': 3, 'major': 'N'}, {'name': 'subject', 'value': 'Decisions and Verdicts', 'rank': 4, 'major': 'N'}, {'name': 'persons', 'value': 'Marshall, Anthony D', 'rank': 5, 'major': 'N'}]",2011-03-29T02:31:20+0000,article,Metro,New York,,News,nyt://article/17916866-c147-5e80-a650-c77fd9296063,427,nyt://article/17916866-c147-5e80-a650-c77fd9296063,Guilty Verdicts Appealed in Brooke Astor Will Case,,,Guilty Verdicts Appealed In Brooke Astor Will Case,,,,By John Eligon,"[{'firstname': 'John', 'middlename': None, 'lastname': 'Eligon', 'qualifier': None, 'title': None, 'role': 'reported', 'organization': '', 'rank': 1}]",,Alzheimer,
"Faced with the possibility that their parents have grown too confused to manage their own finances, many adult children turn to physicians. But often they are ill equipped to help cope with an elderly patient’s financial problems.",https://newoldage.blogs.nytimes.com/2011/02/28/when-dementia-drains-the-pocketbook/,"Faced with the possibility that their parents have grown too confused to manage their own finances, many adult children turn to physicians. But often they are ill equipped to help cope with an elderly patient’s financial problems.","Wendy Miller first became alarmed when her mother began complaining during their phone conversations. “I’m spending so much money,” she fretted. “I can’t figure out why I don’t have any money.” This was a departure: Ms. Miller’s mother, always responsible about her finances, never liked talking about them. Ms. Miller wondered what was going on.",,,The New York Times,[],"[{'name': 'subject', 'value': ""Alzheimer's Disease"", 'rank': 1, 'major': 'N'}, {'name': 'subject', 'value': 'Elderly', 'rank': 2, 'major': 'N'}, {'name': 'subject', 'value': 'Medicine and Health', 'rank': 3, 'major': 'N'}, {'name': 'organizations', 'value': 'Journal of the American Medical Assn', 'rank': 4, 'major': 'N'}, {'name': 'organizations', 'value': 'University of Alabama at Birmingham', 'rank': 5, 'major': 'N'}, {'name': 'organizations', 'value': 'University of California, San Francisco', 'rank': 6, 'major': 'N'}]",2011-02-28T18:50:42+0000,article,,Health,,,nyt://article/847f00ba-7a81-5b5e-b981-871993144c6a,941,nyt://article/847f00ba-7a81-5b5e-b981-871993144c6a,When Dementia Drains the Pocketbook,The New Old Age,,,,,,By Paula Span,"[{'firstname': 'Paula', 'middlename': None, 'lastname': 'Span', 'qualifier': None, 'title': None, 'role': 'reported', 'organization': '', 'rank': 1}]",,Alzheimer,
"The wisdom of wisdom teeth removal, F.D.A. reviews safety of bone drugs, few proven treatments for injured athletes and other consumer-focused news from The New York Times.",https://bucks.blogs.nytimes.com/2011/09/06/tuesday-reading-should-wisdom-teeth-be-removed/,"The wisdom of wisdom teeth removal, F.D.A. reviews safety of bone drugs, few proven treatments for injured athletes and other consumer-focused news from The New York Times.","A variety of consumer-focusend articles appears daily in The New York Times and online in our blogs. Each weekday morning, we gather them together here so you can quickly scan the news that could hit you in your wallet.",,,The New York Times,[],[],2011-09-06T12:47:13+0000,article,,Your Money,,News,nyt://article/acfbb3c4-d99c-5613-8268-ffac1b4edc63,115,nyt://article/acfbb3c4-d99c-5613-8268-ffac1b4edc63,Tuesday Reading: Should Wisdom Teeth Be Removed?,Bucks,,,,,,By Ann Carrns,"[{'firstname': 'Ann', 'middlename': None, 'lastname': 'Carrns', 'qualifier': None, 'title': None, 'role': 'reported', 'organization': '', 'rank': 1}]",,Alzheimer,
"Coffee linked to less depression in women, postage stamps with images of the living, the most dangerous celebrities on the Web and other consumer-focused news from The New York Times.",https://bucks.blogs.nytimes.com/2011/09/27/tuesday-reading-coffee-linked-to-less-depression-in-women/,"Coffee linked to less depression in women, postage stamps with images of the living, the most dangerous celebrities on the Web and other consumer-focused news from The New York Times.","A variety of consumer-focused articles appears daily in The New York Times and online in our blogs. Each weekday morning, we gather them together here so you can quickly scan the news that could hit you in your wallet.",,,The New York Times,[],[],2011-09-27T13:31:59+0000,article,,Your Money,,News,nyt://article/21a3b01b-5b64-52b5-bce4-883e2c5ee46c,114,nyt://article/21a3b01b-5b64-52b5-bce4-883e2c5ee46c,Tuesday Reading: Coffee Linked to Less Depression in Women,Bucks,,,,,,By Ann Carrns,"[{'firstname': 'Ann', 'middlename': None, 'lastname': 'Carrns', 'qualifier': None, 'title': None, 'role': 'reported', 'organization': '', 'rank': 1}]",,Alzheimer,
How The Times reported on Dr. Jack Kevorkian’s first assisted suicide.,https://www.nytimes.com/2011/06/05/weekinreview/05backthen.html,How The Times reported on Dr. Jack Kevorkian’s first assisted suicide.,"Dr. Jack Kevorkian, the central, controversial figure in the national debate over assisted suicide, died last week at age 83 in a hospital outside of Detroit. He first assisted in a suicide in 1990, connecting Janet Adkins, a 54-year-old woman suffering from Alzheimer’s disease, to a device of his own invention. The Times’s Lisa Belkin reported as follows:",WK,4,The New York Times,"[{'rank': 0, 'subtype': 'jumbo', 'caption': None, 'credit': None, 'type': 'image', 'url': 'images/2011/06/05/weekinreview/BACK-THEN/BACK-THEN-jumbo.jpg', 'height': 1024, 'width': 686, 'legacy': {}, 'subType': 'jumbo', 'crop_name': 'jumbo'}, {'rank': 0, 'subtype': 'popup', 'caption': None, 'credit': None, 'type': 'image', 'url': 'images/2011/06/05/weekinreview/BACK-THEN/BACK-THEN-popup.jpg', 'height': 500, 'width': 335, 'legacy': {}, 'subType': 'popup', 'crop_name': 'popup'}, {'rank': 0, 'subtype': 'articleInline', 'caption': None, 'credit': None, 'type': 'image', 'url': 'images/2011/06/05/weekinreview/BACK-THEN/BACK-THEN-articleInline.jpg', 'height': 257, 'width': 190, 'legacy': {}, 'subType': 'articleInline', 'crop_name': 'articleInline'}, {'rank': 0, 'subtype': 'thumbnail', 'caption': None, 'credit': None, 'type': 'image', 'url': 'images/2011/06/05/weekinreview/BACK-THEN/BACK-THEN-thumbStandard.jpg', 'height': 75, 'width': 75, 'legacy': {'thumbnail': 'images/2011/06/05/weekinreview/BACK-THEN/BACK-THEN-thumbStandard.jpg', 'thumbnailwidth': 75, 'thumbnailheight': 75}, 'subType': 'thumbnail', 'crop_name': 'thumbStandard'}]",[],2011-06-04T17:03:48+0000,article,WeekInReview,Week in Review,,News,nyt://article/69e25b4b-3115-5a52-ada0-13cb16baa182,188,nyt://article/69e25b4b-3115-5a52-ada0-13cb16baa182,Back Then: 1990,,,BACK THEN: 1990,,,,,[],,Alzheimer,
The bride is the founder of an ice cream store; the bridegroom is a founder of a publisher of digital travel guides.,https://www.nytimes.com/2011/07/03/fashion/weddings/robyn-goldman-tobin-fisher-weddings.html,The bride is the founder of an ice cream store; the bridegroom is a founder of a publisher of digital travel guides.,"Robyn Sue Goldman, the daughter of Jill S. Goldman and Dr. Lee Goldman of New York, is to be married Sunday to Tobin Joseph Fisher, the son of Gerry A. Fisher and Marshall L. Fisher of Penn Valley, Pa. Jeff Goldman, a brother of the bride, who became a Universal Life minister for the occasion, is to officiate at Holman Ranch in Carmel Valley, Calif.",ST,10,The New York Times,"[{'rank': 0, 'subtype': 'jumbo', 'caption': None, 'credit': None, 'type': 'image', 'url': 'images/2011/07/03/fashion/weddings/03RGOLDMAN/03RGOLDMAN-jumbo.jpg', 'height': 1024, 'width': 959, 'legacy': {}, 'subType': 'jumbo', 'crop_name': 'jumbo'}, {'rank': 0, 'subtype': 'popup', 'caption': None, 'credit': None, 'type': 'image', 'url': 'images/2011/07/03/fashion/weddings/03RGOLDMAN/03RGOLDMAN-popup.jpg', 'height': 500, 'width': 468, 'legacy': {}, 'subType': 'popup', 'crop_name': 'popup'}, {'rank': 0, 'subtype': 'articleInline', 'caption': None, 'credit': None, 'type': 'image', 'url': 'images/2011/07/03/fashion/weddings/03RGOLDMAN/03RGOLDMAN-articleInline.jpg', 'height': 126, 'width': 190, 'legacy': {}, 'subType': 'articleInline', 'crop_name': 'articleInline'}, {'rank': 0, 'subtype': 'thumbnail', 'caption': None, 'credit': None, 'type': 'image', 'url': 'images/2011/07/03/fashion/weddings/03RGOLDMAN/03RGOLDMAN-thumbStandard.jpg', 'height': 75, 'width': 75, 'legacy': {'thumbnail': 'images/2011/07/03/fashion/weddings/03RGOLDMAN/03RGOLDMAN-thumbStandard.jpg', 'thumbnailwidth': 75, 'thumbnailheight': 75}, 'subType': 'thumbnail', 'crop_name': 'thumbStandard'}]","[{'name': 'subject', 'value': 'Weddings and Engagements', 'rank': 1, 'major': 'N'}]",2011-07-02T17:44:51+0000,article,Society,Fashion & Style,Weddings,News,nyt://article/ed38251d-46ae-5bf1-937f-fb312e6fe42b,219,nyt://article/ed38251d-46ae-5bf1-937f-fb312e6fe42b,"Robyn Goldman, Tobin Fisher",,,"Robyn Goldman, Tobin Fisher",,,,,[],,Alzheimer,
"A study on the recession shows that Hispanics were hit the hardest, New Yorkers who buy their dog food at the butcher, airlines raise fares and other consumer-related news from Tuesday’s Times.",https://bucks.blogs.nytimes.com/2011/07/26/tuesday-reading-hispanics-were-hit-hardest-by-the-recession/,"A study on the recession shows that Hispanics were hit the hardest, New Yorkers who buy their dog food at the butcher, airlines raise fares and other consumer-related news from Tuesday’s Times.","A variety of consumer-focused articles appears daily in The New York Times and online in our blogs. Each weekday morning, we gather them together here so you can quickly scan the news that could hit you in your wallet. ",,,The New York Times,[],"[{'name': 'subject', 'value': 'Consumer Behavior', 'rank': 1, 'major': 'N'}, {'name': 'subject', 'value': 'Federal Budget (US)', 'rank': 2, 'major': 'N'}, {'name': 'subject', 'value': 'Unemployment', 'rank': 3, 'major': 'N'}]",2011-07-26T14:31:28+0000,article,,Your Money,,News,nyt://article/fdd5e0ae-ef29-5f0c-8e9d-a11dffbd8900,170,nyt://article/fdd5e0ae-ef29-5f0c-8e9d-a11dffbd8900,Tuesday Reading: Hispanics Were Hit Hardest by the Recession,Bucks,,,,,,By Tara Siegel Bernard,"[{'firstname': 'Tara', 'middlename': 'Siegel', 'lastname': 'Bernard', 'qualifier': None, 'title': None, 'role': 'reported', 'organization': '', 'rank': 1}]",,Alzheimer,
"The couple met at Northwestern, from which they graduated.",https://www.nytimes.com/2011/01/16/fashion/weddings/16markowitz.html,"The couple met at Northwestern, from which they graduated.","Allison Lynn Markowitz and Lt. j.g. Joseph Lorenzo Moroni were married Saturday evening at the C. V. Rich Mansion, an event space in White Plains. Rabbi Jill Hausman officiated.",ST,12,The New York Times,"[{'rank': 0, 'subtype': 'jumbo', 'caption': None, 'credit': None, 'type': 'image', 'url': 'images/2011/01/16/fashion/weddings/16SUBMARKOWITZ/16SUBMARKOWITZ-jumbo.jpg', 'height': 531, 'width': 842, 'legacy': {}, 'subType': 'jumbo', 'crop_name': 'jumbo'}, {'rank': 0, 'subtype': 'popup', 'caption': None, 'credit': None, 'type': 'image', 'url': 'images/2011/01/16/fashion/weddings/16SUBMARKOWITZ/16SUBMARKOWITZ-popup.jpg', 'height': 410, 'width': 650, 'legacy': {}, 'subType': 'popup', 'crop_name': 'popup'}, {'rank': 0, 'subtype': 'articleInline', 'caption': None, 'credit': None, 'type': 'image', 'url': 'images/2011/01/16/fashion/weddings/16SUBMARKOWITZ/16SUBMARKOWITZ-articleInline.jpg', 'height': 126, 'width': 190, 'legacy': {}, 'subType': 'articleInline', 'crop_name': 'articleInline'}, {'rank': 0, 'subtype': 'sfSpan', 'caption': None, 'credit': None, 'type': 'image', 'url': 'images/2011/01/16/fashion/weddings/16SUBMARKOWITZ/16SUBMARKOWITZ-sfSpan.jpg', 'height': 249, 'width': 395, 'legacy': {}, 'subType': 'sfSpan', 'crop_name': 'sfSpan'}, {'rank': 0, 'subtype': 'thumbnail', 'caption': None, 'credit': None, 'type': 'image', 'url': 'images/2011/01/16/fashion/weddings/16SUBMARKOWITZ/16SUBMARKOWITZ-thumbStandard.jpg', 'height': 75, 'width': 75, 'legacy': {'thumbnail': 'images/2011/01/16/fashion/weddings/16SUBMARKOWITZ/16SUBMARKOWITZ-thumbStandard.jpg', 'thumbnailwidth': 75, 'thumbnailheight': 75}, 'subType': 'thumbnail', 'crop_name': 'thumbStandard'}]","[{'name': 'subject', 'value': 'Weddings and Engagements', 'rank': 1, 'major': 'N'}]",2011-01-15T04:04:31+0000,article,Society,Fashion & Style,Weddings,News,nyt://article/f41c0400-7958-5880-b186-0b6b5c9ff21f,272,nyt://article/f41c0400-7958-5880-b186-0b6b5c9ff21f,"Allison Markowitz, Joseph Moroni",,,"Allison Markowitz, Joseph Moroni",,,,,[],,Alzheimer,
"Etta James, the seminal R&B singer, is terminally ill, according to her doctor, Elaine James (who is not related to Etta James).",https://www.nytimes.com/2011/12/19/arts/music/etta-james-is-terminally-ill.html,"Etta James, the seminal R&B singer, is terminally ill, according to her doctor, Elaine James (who is not related to Etta James).","Etta James, the seminal R&B singer, is terminally ill, according to her doctor, Elaine James  (who is not related to Etta James). Dr. James told The Press-Enterprise in Riverside, Calif., that family members were told two weeks ago that Ms. James’s chronic leukemia could not be cured. “I am Southern and Christian and would just ask for the prayers of her fans and friends,” Dr. James said. “They know she’s been sick, but not how sick.” Etta James, 73, has been among the most celebrated American blues singers for decades, recording enduring hits like “At Last,” “Tell Mama” and “I’d Rather Go Blind.” She was inducted into the Rock and Roll Hall of Fame in 1993. Her career was also influenced by drug addiction, troubled love relationships and health and legal problems. In 2010 she was hospitalized for a staph infection, and it became public that she was suffering from Alzheimer’s disease, and that she had been treated for dependence on painkillers. Dr. James has cared for Etta James, above, at her home in Riverside since March 2010, and she made the statements last week outside a hearing over control of Ms. James’s $1 million estate. Donato James, her son, has been fighting in court with her husband, Artis Mills, over who will be named the estate’s conservator.",C,3,The New York Times,[],"[{'name': 'persons', 'value': 'James, Etta', 'rank': 1, 'major': 'N'}, {'name': 'subject', 'value': 'Music', 'rank': 2, 'major': 'N'}, {'name': 'subject', 'value': 'Leukemia', 'rank': 3, 'major': 'N'}]",2011-12-18T22:52:53+0000,article,Culture,Arts,Music,Brief,nyt://article/96b5b85e-d17b-5d09-a158-f74dd8f18ce8,220,nyt://article/96b5b85e-d17b-5d09-a158-f74dd8f18ce8,Etta James Is Terminally Ill,"Arts, Briefly",,Etta James Is Terminally Ill,,,,Compiled by James C. McKinley Jr,"[{'firstname': 'James', 'middlename': 'C.', 'lastname': 'McKinley', 'qualifier': 'Jr', 'title': None, 'role': 'reported', 'organization': '', 'rank': 1}]",,Alzheimer,
The critic and teacher elegantly translated seminal works of Spanish and Portuguese literature.,https://www.nytimes.com/2011/06/05/arts/edwin-honig-a-poet-and-translator-dies-at-91.html,The critic and teacher elegantly translated seminal works of Spanish and Portuguese literature.,"Edwin Honig, a poet, critic and translator known for his elegant English renditions of seminal works of Spanish and Portuguese literature, died on May 25 at his home in Providence, R.I. He was 91.",A,29,The New York Times,"[{'rank': 0, 'subtype': 'xlarge', 'caption': None, 'credit': None, 'type': 'image', 'url': 'images/2011/06/05/arts/dogHONIG-obit/dogHONIG-obit-articleLarge.jpg', 'height': 367, 'width': 600, 'legacy': {'xlarge': 'images/2011/06/05/arts/dogHONIG-obit/dogHONIG-obit-articleLarge.jpg', 'xlargewidth': 600, 'xlargeheight': 367}, 'subType': 'xlarge', 'crop_name': 'articleLarge'}, {'rank': 0, 'subtype': 'blog480', 'caption': None, 'credit': None, 'type': 'image', 'url': 'images/2011/06/05/arts/dogHONIG-obit/dogHONIG-obit-blog480.jpg', 'height': 320, 'width': 480, 'legacy': {}, 'subType': 'blog480', 'crop_name': 'blog480'}, {'rank': 0, 'subtype': 'jumbo', 'caption': None, 'credit': None, 'type': 'image', 'url': 'images/2011/06/05/arts/dogHONIG-obit/dogHONIG-obit-jumbo.jpg', 'height': 683, 'width': 1024, 'legacy': {}, 'subType': 'jumbo', 'crop_name': 'jumbo'}, {'rank': 0, 'subtype': 'popup', 'caption': None, 'credit': None, 'type': 'image', 'url': 'images/2011/06/05/arts/dogHONIG-obit/dogHONIG-obit-popup.jpg', 'height': 433, 'width': 650, 'legacy': {}, 'subType': 'popup', 'crop_name': 'popup'}, {'rank': 0, 'subtype': 'articleInline', 'caption': None, 'credit': None, 'type': 'image', 'url': 'images/2011/06/05/arts/dogHONIG-obit/dogHONIG-obit-articleInline.jpg', 'height': 127, 'width': 190, 'legacy': {}, 'subType': 'articleInline', 'crop_name': 'articleInline'}, {'rank': 0, 'subtype': 'sfSpan', 'caption': None, 'credit': None, 'type': 'image', 'url': 'images/2011/06/05/arts/dogHONIG-obit/dogHONIG-obit-sfSpan.jpg', 'height': 263, 'width': 395, 'legacy': {}, 'subType': 'sfSpan', 'crop_name': 'sfSpan'}, {'rank': 0, 'subtype': 'thumbnail', 'caption': None, 'credit': None, 'type': 'image', 'url': 'images/2011/06/05/arts/dogHONIG-obit/dogHONIG-obit-thumbStandard.jpg', 'height': 75, 'width': 75, 'legacy': {'thumbnail': 'images/2011/06/05/arts/dogHONIG-obit/dogHONIG-obit-thumbStandard.jpg', 'thumbnailwidth': 75, 'thumbnailheight': 75}, 'subType': 'thumbnail', 'crop_name': 'thumbStandard'}]","[{'name': 'subject', 'value': 'Books and Literature', 'rank': 1, 'major': 'N'}, {'name': 'subject', 'value': 'Translation', 'rank': 2, 'major': 'N'}, {'name': 'subject', 'value': 'Deaths (Obituaries)', 'rank': 3, 'major': 'N'}, {'name': 'subject', 'value': 'Poetry and Poets', 'rank': 4, 'major': 'N'}, {'name': 'subject', 'value': 'Colleges and Universities', 'rank': 5, 'major': 'N'}]",2011-06-05T00:27:30+0000,article,Culture,Arts,,Obituary (Obit),nyt://article/67e5d774-fcee-595b-b099-70e732248cc7,628,nyt://article/67e5d774-fcee-595b-b099-70e732248cc7,"Edwin Honig, a Poet, Professor and Translator, Dies at 91",,,"Edwin Honig, a Poet, Professor and Translator, Dies at 91",,,,By Margalit Fox,"[{'firstname': 'Margalit', 'middlename': None, 'lastname': 'Fox', 'qualifier': None, 'title': None, 'role': 'reported', 'organization': '', 'rank': 1}]",,Alzheimer,
"Social pressures may affect men’s and women’s different crying habits, but research suggests there is a hormonal difference at work as well.",https://www.nytimes.com/2011/01/04/science/04qna.html,"Social pressures may affect men’s and women’s different crying habits, but research suggests there is a hormonal difference at work as well.","Q. Is it true that women’s tears contain an enzyme that can be released only by crying, meaning they are quicker to cry under emotional stress?",D,2,The New York Times,"[{'rank': 0, 'subtype': 'jumbo', 'caption': None, 'credit': None, 'type': 'image', 'url': 'images/2011/01/04/science/04QNA/04QNA-jumbo.jpg', 'height': 1024, 'width': 967, 'legacy': {}, 'subType': 'jumbo', 'crop_name': 'jumbo'}, {'rank': 0, 'subtype': 'popup', 'caption': None, 'credit': None, 'type': 'image', 'url': 'images/2011/01/04/science/04QNA/04QNA-popup.jpg', 'height': 500, 'width': 472, 'legacy': {}, 'subType': 'popup', 'crop_name': 'popup'}, {'rank': 0, 'subtype': 'articleInline', 'caption': None, 'credit': None, 'type': 'image', 'url': 'images/2011/01/04/science/04QNA/04QNA-articleInline.jpg', 'height': 202, 'width': 190, 'legacy': {}, 'subType': 'articleInline', 'crop_name': 'articleInline'}, {'rank': 0, 'subtype': 'thumbnail', 'caption': None, 'credit': None, 'type': 'image', 'url': 'images/2011/01/04/science/04QNA/04QNA-thumbStandard.jpg', 'height': 75, 'width': 75, 'legacy': {'thumbnail': 'images/2011/01/04/science/04QNA/04QNA-thumbStandard.jpg', 'thumbnailwidth': 75, 'thumbnailheight': 75}, 'subType': 'thumbnail', 'crop_name': 'thumbStandard'}]","[{'name': 'subject', 'value': 'Crying', 'rank': 1, 'major': 'N'}, {'name': 'subject', 'value': 'Hormones', 'rank': 2, 'major': 'N'}, {'name': 'subject', 'value': 'Women and Girls', 'rank': 3, 'major': 'N'}, {'name': 'subject', 'value': 'Science and Technology', 'rank': 4, 'major': 'N'}]",2011-01-03T23:54:49+0000,article,Science,Science,,Question,nyt://article/b1faece7-80b5-524d-a97c-7c05b623b531,220,nyt://article/b1faece7-80b5-524d-a97c-7c05b623b531,This Vale of Tears,Q & A,,This Vale of Tears,,,,By C. Claiborne Ray,"[{'firstname': 'C.', 'middlename': 'Claiborne', 'lastname': 'Ray', 'qualifier': None, 'title': None, 'role': 'reported', 'organization': '', 'rank': 1}]",,Alzheimer,
"A new type of brain scan may help accurately identify Parkinson’s disease, but it will not be cheap and effective therapies are still lacking.",https://newoldage.blogs.nytimes.com/2011/05/12/a-portrait-of-parkinsons-disease/,"A new type of brain scan may help accurately identify Parkinson’s disease, but it will not be cheap and effective therapies are still lacking.","Karen Alexander says she is “one of the lucky ones.” Ten years after learning she has Parkinson’s disease, she takes two drugs to control her symptoms and so far has few of them. A tremor on her left side can make it hard to balance a teacup and saucer, but “at 74, it doesn’t bother me much,” she said. Luckily, Ms. Alexander, who lives in a suburb west of Chicago, is right-handed.",,,The New York Times,[],"[{'name': 'subject', 'value': 'Dopamine', 'rank': 1, 'major': 'N'}, {'name': 'subject', 'value': 'Elderly', 'rank': 2, 'major': 'N'}, {'name': 'subject', 'value': 'Medicine and Health', 'rank': 3, 'major': 'N'}, {'name': 'subject', 'value': ""Parkinson's Disease"", 'rank': 4, 'major': 'N'}]",2011-05-12T15:17:48+0000,article,,Health,,,nyt://article/dbc1271c-1a5e-5c80-acf7-e537b84fb93e,629,nyt://article/dbc1271c-1a5e-5c80-acf7-e537b84fb93e,A Portrait of Parkinson’s Disease,The New Old Age,,,,,,By Milt Freudenheim,"[{'firstname': 'Milt', 'middlename': None, 'lastname': 'Freudenheim', 'qualifier': None, 'title': None, 'role': 'reported', 'organization': '', 'rank': 1}]",,Alzheimer,
The Ames straw poll is a carnival for political junkies and special interest groups.,https://thecaucus.blogs.nytimes.com/2011/08/13/lines-form-at-ames-amid-hawkers/,The Ames straw poll is a carnival for political junkies and special interest groups.,"AMES, Iowa — The line has formed for folks at the straw poll to begin voting. The candidate tents are rocking with music. And Teddy Roosevelt and Abraham Lincoln are walking around.",,,The New York Times,[],"[{'name': 'subject', 'value': 'Presidential Election of 2012', 'rank': 1, 'major': 'N'}, {'name': 'subject', 'value': 'Windmills', 'rank': 2, 'major': 'N'}, {'name': 'persons', 'value': 'Huckabee, Mike', 'rank': 3, 'major': 'N'}, {'name': 'persons', 'value': 'Lincoln, Abraham', 'rank': 4, 'major': 'N'}, {'name': 'organizations', 'value': 'National Rifle Assn', 'rank': 5, 'major': 'N'}, {'name': 'glocations', 'value': 'Iowa', 'rank': 6, 'major': 'N'}]",2011-08-13T15:58:46+0000,article,,U.S.,Politics,News,nyt://article/cb9adabe-f5f4-50e3-9e80-a3fb7bb58dc1,245,nyt://article/cb9adabe-f5f4-50e3-9e80-a3fb7bb58dc1,Queuing Up for the Straw Poll,,,,,,,By Michael D. Shear,"[{'firstname': 'Michael', 'middlename': None, 'lastname': None, 'qualifier': None, 'title': None, 'role': 'reported', 'organization': '', 'rank': 1}]",,Alzheimer,
The pharmaceutical company braces for generic competition as Lipitor loses patent protection.,https://prescriptions.blogs.nytimes.com/2011/08/02/pfizer-reports-higher-profits/,The pharmaceutical company braces for generic competition as Lipitor loses patent protection.,"The pharmaceutical giant Pfizer reported on Tuesday that its profits rose 5 percent in the second quarter compared to a year ago, as lower taxes and acquisition-related costs and strong sales in animal products and nutrition helped to offset losses elsewhere.",,,The New York Times,[],"[{'name': 'subject', 'value': 'Drugs (Pharmaceuticals)', 'rank': 1, 'major': 'N'}, {'name': 'organizations', 'value': 'Pfizer Inc', 'rank': 2, 'major': 'N'}]",2011-08-02T16:48:57+0000,article,,Health,,News,nyt://article/340ea465-2e63-5e55-ab63-0c7f365faddc,285,nyt://article/340ea465-2e63-5e55-ab63-0c7f365faddc,Pfizer Reports Higher Profits,Prescriptions,,,,,,By Katie Thomas,"[{'firstname': 'Katie', 'middlename': None, 'lastname': 'Thomas', 'qualifier': None, 'title': None, 'role': 'reported', 'organization': '', 'rank': 1}]",,Alzheimer,
