abstract,web_url,snippet,lead_paragraph,print_section,print_page,source,multimedia,keywords,pub_date,document_type,news_desk,section_name,subsection_name,type_of_material,_id,word_count,uri,headline.main,headline.kicker,headline.content_kicker,headline.print_headline,headline.name,headline.seo,headline.sub,byline.original,byline.person,byline.organization,query_consulta,slideshow_credits
"These were among my early lessons in how hard it is to be old — how long everything takes, how much some of it hurts, and how a caregiver must stop moving at warp speed and adapt to the pace of someone who is disabled.",https://newoldage.blogs.nytimes.com/2011/04/22/the-time-it-takes/,"These were among my early lessons in how hard it is to be old — how long everything takes, how much some of it hurts, and how a caregiver must stop moving at warp speed and adapt to the pace of someone who is disabled.","An M.R.I. was a huge ordeal for someone as old and crippled as my mother. The first few times she had them, while still living in Florida, I was not with her; I’d asked only afterward about the awful banging and claustrophobia inside that tube. But once I became her regular M.R.I. escort, I found there was so much more to this appointment for her. It came as a revelation to me that these tests are far different for someone in her 80s than for someone in her 50s.",,,The New York Times,[],"[{'name': 'subject', 'value': 'Elder Care', 'rank': 1, 'major': 'N'}, {'name': 'subject', 'value': 'Elderly', 'rank': 2, 'major': 'N'}]",2011-04-22T14:36:19+0000,article,,Health,,,nyt://article/58ab4d1e-ec90-544e-8dd7-758e1f32088d,898,nyt://article/58ab4d1e-ec90-544e-8dd7-758e1f32088d,The Time It Takes,The New Old Age,,,,,,By Jane Gross,"[{'firstname': 'Jane', 'middlename': None, 'lastname': 'Gross', 'qualifier': None, 'title': None, 'role': 'reported', 'organization': '', 'rank': 1}]",,Alzheimer,
Mr. Neville may be best known in the United States as the title character in “The Adventures of Baron Munchausen.”,https://www.nytimes.com/2011/11/22/theater/john-neville-shakespearean-actor-dies-at-86.html,Mr. Neville may be best known in the United States as the title character in “The Adventures of Baron Munchausen.”,"John Neville, who played Romeo to Claire Bloom’s Juliet, Hamlet to Judi Dench’s Ophelia and Othello to Richard Burton’s Iago (and vice versa), but who may be best known in the United States as the title character in the exuberantly loopy film “The Adventures of Baron Munchausen” and a recurring one in the television series “The X-Files,” died in Toronto on Saturday. He was 86. ",B,13,The New York Times,"[{'rank': 0, 'subtype': 'jumbo', 'caption': None, 'credit': None, 'type': 'image', 'url': 'images/2011/11/22/theater/NEVILLE2-obit/NEVILLE2-obit-jumbo.jpg', 'height': 1024, 'width': 819, 'legacy': {}, 'subType': 'jumbo', 'crop_name': 'jumbo'}, {'rank': 0, 'subtype': 'popup', 'caption': None, 'credit': None, 'type': 'image', 'url': 'images/2011/11/22/theater/NEVILLE2-obit/NEVILLE2-obit-popup.jpg', 'height': 500, 'width': 400, 'legacy': {}, 'subType': 'popup', 'crop_name': 'popup'}, {'rank': 0, 'subtype': 'articleInline', 'caption': None, 'credit': None, 'type': 'image', 'url': 'images/2011/11/22/theater/NEVILLE2-obit/NEVILLE2-obit-articleInline.jpg', 'height': 238, 'width': 190, 'legacy': {}, 'subType': 'articleInline', 'crop_name': 'articleInline'}, {'rank': 0, 'subtype': 'thumbnail', 'caption': None, 'credit': None, 'type': 'image', 'url': 'images/2011/11/22/theater/NEVILLE2-obit/NEVILLE2-obit-thumbStandard.jpg', 'height': 75, 'width': 75, 'legacy': {'thumbnail': 'images/2011/11/22/theater/NEVILLE2-obit/NEVILLE2-obit-thumbStandard.jpg', 'thumbnailwidth': 75, 'thumbnailheight': 75}, 'subType': 'thumbnail', 'crop_name': 'thumbStandard'}]","[{'name': 'subject', 'value': 'Theater', 'rank': 1, 'major': 'N'}, {'name': 'subject', 'value': 'Actors and Actresses', 'rank': 2, 'major': 'N'}, {'name': 'glocations', 'value': 'Toronto (Ontario)', 'rank': 3, 'major': 'N'}, {'name': 'subject', 'value': 'Deaths (Obituaries)', 'rank': 4, 'major': 'N'}]",2011-11-22T03:13:16+0000,article,Culture,Theater,,Obituary (Obit),nyt://article/e9f9513e-b3ee-5699-ad22-70a4dc8a5d78,1038,nyt://article/e9f9513e-b3ee-5699-ad22-70a4dc8a5d78,"John Neville, Shakespearean Actor and ‘Munchausen’ Star, Is Dead at 86",,,"John Neville, Shakespearean Actor And ‘Munchausen’ Star, Is Dead at 86",,,,By Bruce Weber,"[{'firstname': 'Bruce', 'middlename': None, 'lastname': 'Weber', 'qualifier': None, 'title': None, 'role': 'reported', 'organization': '', 'rank': 1}]",,Alzheimer,
People know Casey Stengel for his platoon tactics and his salty and obscure language. Toni Mollett Harsh has added a new image of this man for all seasons: Uncle Casey.,https://www.nytimes.com/2011/04/17/sports/baseball/17vecsey.html,People know Casey Stengel for his platoon tactics and his salty and obscure language. Toni Mollett Harsh has added a new image of this man for all seasons: Uncle Casey.,Uncle Casey?,SP,2,The New York Times,"[{'rank': 0, 'subtype': 'xlarge', 'caption': None, 'credit': None, 'type': 'image', 'url': 'images/2011/04/17/sports/Y-JP-VECSEY1/Y-JP-VECSEY1-articleLarge.jpg', 'height': 315, 'width': 600, 'legacy': {'xlarge': 'images/2011/04/17/sports/Y-JP-VECSEY1/Y-JP-VECSEY1-articleLarge.jpg', 'xlargewidth': 600, 'xlargeheight': 315}, 'subType': 'xlarge', 'crop_name': 'articleLarge'}, {'rank': 0, 'subtype': 'blog480', 'caption': None, 'credit': None, 'type': 'image', 'url': 'images/2011/04/17/sports/Y-JP-VECSEY1/Y-JP-VECSEY1-blog480.jpg', 'height': 326, 'width': 480, 'legacy': {}, 'subType': 'blog480', 'crop_name': 'blog480'}, {'rank': 0, 'subtype': 'jumbo', 'caption': None, 'credit': None, 'type': 'image', 'url': 'images/2011/04/17/sports/Y-JP-VECSEY1/Y-JP-VECSEY1-jumbo.jpg', 'height': 696, 'width': 1024, 'legacy': {}, 'subType': 'jumbo', 'crop_name': 'jumbo'}, {'rank': 0, 'subtype': 'popup', 'caption': None, 'credit': None, 'type': 'image', 'url': 'images/2011/04/17/sports/Y-JP-VECSEY1/Y-JP-VECSEY1-popup.jpg', 'height': 442, 'width': 650, 'legacy': {}, 'subType': 'popup', 'crop_name': 'popup'}, {'rank': 0, 'subtype': 'articleInline', 'caption': None, 'credit': None, 'type': 'image', 'url': 'images/2011/04/17/sports/Y-JP-VECSEY1/Y-JP-VECSEY1-articleInline.jpg', 'height': 129, 'width': 190, 'legacy': {}, 'subType': 'articleInline', 'crop_name': 'articleInline'}, {'rank': 0, 'subtype': 'sfSpan', 'caption': None, 'credit': None, 'type': 'image', 'url': 'images/2011/04/17/sports/Y-JP-VECSEY1/Y-JP-VECSEY1-sfSpan.jpg', 'height': 269, 'width': 395, 'legacy': {}, 'subType': 'sfSpan', 'crop_name': 'sfSpan'}, {'rank': 0, 'subtype': 'thumbnail', 'caption': None, 'credit': None, 'type': 'image', 'url': 'images/2011/04/17/sports/Y-JP-VECSEY1/Y-JP-VECSEY1-thumbStandard.jpg', 'height': 75, 'width': 75, 'legacy': {'thumbnail': 'images/2011/04/17/sports/Y-JP-VECSEY1/Y-JP-VECSEY1-thumbStandard.jpg', 'thumbnailwidth': 75, 'thumbnailheight': 75}, 'subType': 'thumbnail', 'crop_name': 'thumbStandard'}]","[{'name': 'organizations', 'value': 'Museum of the City of New York', 'rank': 1, 'major': 'N'}, {'name': 'persons', 'value': 'Stengel, Casey', 'rank': 2, 'major': 'N'}, {'name': 'subject', 'value': 'Baseball', 'rank': 3, 'major': 'N'}, {'name': 'organizations', 'value': 'New York Yankees', 'rank': 4, 'major': 'N'}]",2011-04-16T14:48:14+0000,article,Sports,Sports,Baseball,News,nyt://article/8628513c-edf8-5ff1-9208-85322df4be45,1008,nyt://article/8628513c-edf8-5ff1-9208-85322df4be45,A Summer With Uncle Casey in the Town He Owned,Sports of The Times,,A Summer With Uncle Casey In the Town He Owned,,,,By George Vecsey,"[{'firstname': 'George', 'middlename': None, 'lastname': 'Vecsey', 'qualifier': None, 'title': None, 'role': 'reported', 'organization': '', 'rank': 1}]",,Alzheimer,
The Children’s Aid Society helped Desiree and Robert Whitlow to pay bills while they were jobless and to enroll their daughter with the Dance Theater of Harlem.,https://www.nytimes.com/2011/01/01/nyregion/01neediest.html,The Children’s Aid Society helped Desiree and Robert Whitlow to pay bills while they were jobless and to enroll their daughter with the Dance Theater of Harlem.,"Whenever life throws an obstacle in Desiree Whitlow’s path, she simply changes direction.",A,14,The New York Times,"[{'rank': 0, 'subtype': 'xlarge', 'caption': None, 'credit': None, 'type': 'image', 'url': 'images/2011/01/01/nyregion/SUB-NEEDIEST_span/SUB-NEEDIEST-articleLarge.jpg', 'height': 350, 'width': 600, 'legacy': {'xlarge': 'images/2011/01/01/nyregion/SUB-NEEDIEST_span/SUB-NEEDIEST-articleLarge.jpg', 'xlargewidth': 600, 'xlargeheight': 350}, 'subType': 'xlarge', 'crop_name': 'articleLarge'}, {'rank': 0, 'subtype': 'jumbo', 'caption': None, 'credit': None, 'type': 'image', 'url': 'images/2011/01/01/nyregion/SUB-NEEDIEST_span/SUB-NEEDIEST-jumbo.jpg', 'height': 683, 'width': 1024, 'legacy': {}, 'subType': 'jumbo', 'crop_name': 'jumbo'}, {'rank': 0, 'subtype': 'popup', 'caption': None, 'credit': None, 'type': 'image', 'url': 'images/2011/01/01/nyregion/SUB-NEEDIEST_span/SUB-NEEDIEST-popup.jpg', 'height': 433, 'width': 650, 'legacy': {}, 'subType': 'popup', 'crop_name': 'popup'}, {'rank': 0, 'subtype': 'articleInline', 'caption': None, 'credit': None, 'type': 'image', 'url': 'images/2011/01/01/nyregion/SUB-NEEDIEST_span/SUB-NEEDIEST-articleInline.jpg', 'height': 127, 'width': 190, 'legacy': {}, 'subType': 'articleInline', 'crop_name': 'articleInline'}, {'rank': 0, 'subtype': 'sfSpan', 'caption': None, 'credit': None, 'type': 'image', 'url': 'images/2011/01/01/nyregion/SUB-NEEDIEST_span/SUB-NEEDIEST-sfSpan.jpg', 'height': 260, 'width': 395, 'legacy': {}, 'subType': 'sfSpan', 'crop_name': 'sfSpan'}, {'rank': 0, 'subtype': 'thumbnail', 'caption': None, 'credit': None, 'type': 'image', 'url': 'images/2011/01/01/nyregion/SUB-NEEDIEST_span/SUB-NEEDIEST-thumbStandard.jpg', 'height': 75, 'width': 75, 'legacy': {'thumbnail': 'images/2011/01/01/nyregion/SUB-NEEDIEST_span/SUB-NEEDIEST-thumbStandard.jpg', 'thumbnailwidth': 75, 'thumbnailheight': 75}, 'subType': 'thumbnail', 'crop_name': 'thumbStandard'}]","[{'name': 'organizations', 'value': 'New York Times Neediest Cases Fund', 'rank': 1, 'major': 'N'}, {'name': 'organizations', 'value': ""Children's Aid Society"", 'rank': 2, 'major': 'N'}, {'name': 'subject', 'value': 'Philanthropy', 'rank': 3, 'major': 'N'}]",2011-01-01T01:53:59+0000,article,Metro,New York,,News,nyt://article/5500fea5-8476-5f08-a1d1-932cb45e898a,694,nyt://article/5500fea5-8476-5f08-a1d1-932cb45e898a,Tiding a Couple Over and Helping Their Daughter Learn to Dance,The Neediest Cases,,Paving Their Own Way and Helping Their Daughter Develop as a Dancer,,,,By Jennifer Mascia,"[{'firstname': 'Jennifer', 'middlename': None, 'lastname': 'Mascia', 'qualifier': None, 'title': None, 'role': 'reported', 'organization': '', 'rank': 1}]",,Alzheimer,
One good idea each from the seven Republican presidential candidates.,https://campaignstops.blogs.nytimes.com/2011/12/27/getting-it-right/,One good idea each from the seven Republican presidential candidates.,"Dissatisfaction and disappointment have pervaded the Republican presidential campaign. Pundits pining for a game-changing candidate have been repeatedly let down, and voters have pinballed from one unsatisfactory option to another, with infatuation giving way to disillusionment every time.",,,The New York Times,[],"[{'name': 'persons', 'value': 'Bachmann, Michele M', 'rank': 1, 'major': 'N'}, {'name': 'persons', 'value': 'Gingrich, Newt', 'rank': 2, 'major': 'N'}, {'name': 'persons', 'value': 'Huntsman, Jon M Jr', 'rank': 3, 'major': 'N'}, {'name': 'persons', 'value': 'Obama, Barack', 'rank': 4, 'major': 'N'}, {'name': 'persons', 'value': 'Paul, Ron', 'rank': 5, 'major': 'N'}, {'name': 'persons', 'value': 'Perry, Rick', 'rank': 6, 'major': 'N'}, {'name': 'persons', 'value': 'Romney, Mitt', 'rank': 7, 'major': 'N'}, {'name': 'persons', 'value': 'Ryan, Paul D Jr', 'rank': 8, 'major': 'N'}, {'name': 'persons', 'value': 'Santorum, Rick', 'rank': 9, 'major': 'N'}]",2011-12-28T04:24:03+0000,article,,Opinion,,News,nyt://article/a0ffb76d-9c6a-5a40-b623-c6c90712f398,940,nyt://article/a0ffb76d-9c6a-5a40-b623-c6c90712f398,Getting It Right,Campaign Stops,,,,,,By Ross Douthat,"[{'firstname': 'Ross', 'middlename': None, 'lastname': 'Douthat', 'qualifier': None, 'title': None, 'role': 'reported', 'organization': '', 'rank': 1}]",,Alzheimer,
Mr. Haast relied on daily injections of snake venom to protect him from the 173 bites he sustained while handling some three million snakes.,https://www.nytimes.com/2011/06/18/us/18haast.html,Mr. Haast relied on daily injections of snake venom to protect him from the 173 bites he sustained while handling some three million snakes.,"Bill Haast figured he had handled more than three million poisonous snakes over the years, and he had the hands to prove it.",B,8,The New York Times,"[{'rank': 0, 'subtype': 'jumbo', 'caption': None, 'credit': None, 'type': 'image', 'url': 'images/2011/06/18/us/18haast2_cnd/18haast2_cnd-jumbo.jpg', 'height': 1024, 'width': 576, 'legacy': {}, 'subType': 'jumbo', 'crop_name': 'jumbo'}, {'rank': 0, 'subtype': 'popup', 'caption': None, 'credit': None, 'type': 'image', 'url': 'images/2011/06/18/us/18haast2_cnd/18haast2_cnd-popup.jpg', 'height': 500, 'width': 281, 'legacy': {}, 'subType': 'popup', 'crop_name': 'popup'}, {'rank': 0, 'subtype': 'articleInline', 'caption': None, 'credit': None, 'type': 'image', 'url': 'images/2011/06/18/us/18haast2_cnd/18haast2_cnd-articleInline.jpg', 'height': 257, 'width': 190, 'legacy': {}, 'subType': 'articleInline', 'crop_name': 'articleInline'}, {'rank': 0, 'subtype': 'thumbnail', 'caption': None, 'credit': None, 'type': 'image', 'url': 'images/2011/06/18/us/18haast2_cnd/18haast2_cnd-thumbStandard.jpg', 'height': 75, 'width': 75, 'legacy': {'thumbnail': 'images/2011/06/18/us/18haast2_cnd/18haast2_cnd-thumbStandard.jpg', 'thumbnailwidth': 75, 'thumbnailheight': 75}, 'subType': 'thumbnail', 'crop_name': 'thumbStandard'}]","[{'name': 'subject', 'value': 'Animals', 'rank': 1, 'major': 'N'}, {'name': 'subject', 'value': 'Medicine and Health', 'rank': 2, 'major': 'N'}, {'name': 'subject', 'value': 'Snakes', 'rank': 3, 'major': 'N'}, {'name': 'subject', 'value': 'Deaths (Obituaries)', 'rank': 4, 'major': 'N'}]",2011-06-18T00:24:16+0000,article,National,U.S.,,Obituary (Obit),nyt://article/2bf7d3ef-94b3-5a28-821d-9bb9eb65a652,998,nyt://article/2bf7d3ef-94b3-5a28-821d-9bb9eb65a652,"Bill Haast, a Man Charmed by Snakes, Dies at 100",,,"Bill Haast, a Man Charmed by Snakes, Dies at 100",,,,By Douglas Martin,"[{'firstname': 'Douglas', 'middlename': None, 'lastname': 'Martin', 'qualifier': None, 'title': None, 'role': 'reported', 'organization': '', 'rank': 1}]",,Alzheimer,
"A United Nations-backed war crimes tribunal announced Thursday that Ieng Thirith, the former minister for social affairs for the Khmer Rouge, should be unconditionally released.",https://www.nytimes.com/2011/11/18/world/asia/sickly-defendant-khmer-rouge-genocide-trial-in-cambodia-may-be-freed.html,"A United Nations-backed war crimes tribunal announced Thursday that Ieng Thirith, the former minister for social affairs for the Khmer Rouge, should be unconditionally released.","PHNOM PENH, Cambodia — A tribunal backed by the United Nations that is trying top leaders of the Khmer Rouge announced on Thursday that a sister-in-law of the regime’s former leader, Pol Pot, was unfit to stand trial and should be released because she suffers from dementia.",A,10,The New York Times,"[{'rank': 0, 'subtype': 'jumbo', 'caption': None, 'credit': None, 'type': 'image', 'url': 'images/2011/11/18/world/18cambodia/18cambodia-jumbo.jpg', 'height': 1024, 'width': 740, 'legacy': {}, 'subType': 'jumbo', 'crop_name': 'jumbo'}, {'rank': 0, 'subtype': 'popup', 'caption': None, 'credit': None, 'type': 'image', 'url': 'images/2011/11/18/world/18cambodia/18cambodia-popup.jpg', 'height': 500, 'width': 361, 'legacy': {}, 'subType': 'popup', 'crop_name': 'popup'}, {'rank': 0, 'subtype': 'articleInline', 'caption': None, 'credit': None, 'type': 'image', 'url': 'images/2011/11/18/world/18cambodia/18cambodia-articleInline.jpg', 'height': 263, 'width': 190, 'legacy': {}, 'subType': 'articleInline', 'crop_name': 'articleInline'}, {'rank': 0, 'subtype': 'thumbnail', 'caption': None, 'credit': None, 'type': 'image', 'url': 'images/2011/11/18/world/18cambodia/18cambodia-thumbStandard.jpg', 'height': 75, 'width': 75, 'legacy': {'thumbnail': 'images/2011/11/18/world/18cambodia/18cambodia-thumbStandard.jpg', 'thumbnailwidth': 75, 'thumbnailheight': 75}, 'subType': 'thumbnail', 'crop_name': 'thumbStandard'}]","[{'name': 'organizations', 'value': 'United Nations', 'rank': 1, 'major': 'N'}, {'name': 'subject', 'value': 'War Crimes, Genocide and Crimes Against Humanity', 'rank': 2, 'major': 'N'}, {'name': 'persons', 'value': 'Pol Pot', 'rank': 3, 'major': 'N'}, {'name': 'organizations', 'value': 'Khmer Rouge', 'rank': 4, 'major': 'N'}, {'name': 'persons', 'value': 'Ieng Thirith', 'rank': 5, 'major': 'N'}, {'name': 'glocations', 'value': 'Cambodia', 'rank': 6, 'major': 'N'}]",2011-11-17T16:05:51+0000,article,Foreign,World,Asia Pacific,News,nyt://article/4d2d16b1-5415-5acb-8357-1972fd2922ba,998,nyt://article/4d2d16b1-5415-5acb-8357-1972fd2922ba,U.N. Court in Cambodia Recommends Freeing Defendant Ill With Dementia,,,U.N. Court in Cambodia Recommends Freeing Defendant Ill With Dementia,,,,By Seth Mydans,"[{'firstname': 'Seth', 'middlename': None, 'lastname': 'Mydans', 'qualifier': None, 'title': None, 'role': 'reported', 'organization': '', 'rank': 1}]",,Alzheimer,
Scientists observe elephant interactions during the extreme dry period in Namibia to better understand an emerging pattern of dominance between extremely wet and extremely dry years.,https://scientistatwork.blogs.nytimes.com/2011/09/08/rules-of-engagement-in-the-elephant-world/,Scientists observe elephant interactions during the extreme dry period in Namibia to better understand an emerging pattern of dominance between extremely wet and extremely dry years.,"Caitlin O’Connell-Rodwell, who teaches at the Stanford University School of Medicine, writes from Etosha National Park, Namibia, where she is studying elephant societies.",,,The New York Times,[],"[{'name': 'subject', 'value': 'Elephants', 'rank': 1, 'major': 'N'}, {'name': 'subject', 'value': 'Science and Technology', 'rank': 2, 'major': 'N'}, {'name': 'glocations', 'value': 'Namibia', 'rank': 3, 'major': 'N'}]",2011-09-08T20:37:36+0000,article,,Science,,News,nyt://article/7bba3b51-bde9-515f-ac0a-6199cd197987,1011,nyt://article/7bba3b51-bde9-515f-ac0a-6199cd197987,Rules of Engagement in the Elephant World,Scientist at Work,,,,,,By Caitlin O'Connell-Rodwell,"[{'firstname': 'Caitlin', 'middlename': None, 'lastname': ""O'Connell-Rodwell"", 'qualifier': None, 'title': None, 'role': 'reported', 'organization': '', 'rank': 1}]",,Alzheimer,
Researchers at Boston University acknowledge they need to study a wider sample of the brains of former N.F.L. players to validate findings on trauma.,https://www.nytimes.com/2011/05/08/sports/football/08duerson.html,Researchers at Boston University acknowledge they need to study a wider sample of the brains of former N.F.L. players to validate findings on trauma.,"When the N.F.L. veteran Andre Waters killed himself in late 2006, the subsequent discovery of damage in his brain shocked the football community into asking how many other retired players might have an incurable disease.",SP,6,The New York Times,"[{'rank': 0, 'subtype': 'blog480', 'caption': None, 'credit': None, 'type': 'image', 'url': 'images/2011/05/08/sports/duerson/duerson-blog480.jpg', 'height': 300, 'width': 480, 'legacy': {}, 'subType': 'blog480', 'crop_name': 'blog480'}, {'rank': 0, 'subtype': 'jumbo', 'caption': None, 'credit': None, 'type': 'image', 'url': 'images/2011/05/08/sports/duerson/duerson-jumbo.jpg', 'height': 641, 'width': 1024, 'legacy': {}, 'subType': 'jumbo', 'crop_name': 'jumbo'}, {'rank': 0, 'subtype': 'popup', 'caption': None, 'credit': None, 'type': 'image', 'url': 'images/2011/05/08/sports/duerson/duerson-popup.jpg', 'height': 407, 'width': 650, 'legacy': {}, 'subType': 'popup', 'crop_name': 'popup'}, {'rank': 0, 'subtype': 'articleInline', 'caption': None, 'credit': None, 'type': 'image', 'url': 'images/2011/05/08/sports/duerson/duerson-articleInline.jpg', 'height': 119, 'width': 190, 'legacy': {}, 'subType': 'articleInline', 'crop_name': 'articleInline'}, {'rank': 0, 'subtype': 'sfSpan', 'caption': None, 'credit': None, 'type': 'image', 'url': 'images/2011/05/08/sports/duerson/duerson-sfSpan.jpg', 'height': 247, 'width': 395, 'legacy': {}, 'subType': 'sfSpan', 'crop_name': 'sfSpan'}]","[{'name': 'persons', 'value': 'Duerson, Dave', 'rank': 1, 'major': 'N'}, {'name': 'subject', 'value': 'Brain', 'rank': 2, 'major': 'N'}, {'name': 'subject', 'value': 'Concussions', 'rank': 3, 'major': 'N'}, {'name': 'subject', 'value': 'Chronic Traumatic Encephalopathy', 'rank': 4, 'major': 'N'}, {'name': 'subject', 'value': 'Sports Injuries', 'rank': 5, 'major': 'N'}, {'name': 'subject', 'value': 'Football', 'rank': 6, 'major': 'N'}, {'name': 'persons', 'value': 'Waters, Andre', 'rank': 7, 'major': 'N'}, {'name': 'subject', 'value': 'Traumatic Brain Injury', 'rank': 8, 'major': 'N'}, {'name': 'organizations', 'value': 'National Football League', 'rank': 9, 'major': 'N'}]",2011-05-07T15:41:44+0000,article,Sports,Sports,Pro Football,News Analysis,nyt://article/bbaad28b-dc10-5a4f-ac61-282be46832f8,980,nyt://article/bbaad28b-dc10-5a4f-ac61-282be46832f8,The Next Step for Researchers Is Not Finding Brain Trauma,Analysis,,The Next Step for Researchers Is Not Finding Brain Trauma,,,,By Alan Schwarz,"[{'firstname': 'Alan', 'middlename': None, 'lastname': 'Schwarz', 'qualifier': None, 'title': None, 'role': 'reported', 'organization': '', 'rank': 1}]",,Alzheimer,
"Asghar Farhadi’s “Separation,” with its deliberate ambiguities and multiple points of view, looks at the complexities of life in Iran.",https://www.nytimes.com/2012/01/01/movies/awardsseason/stephen-holden-takes-a-closer-look-at-a-separation.html,"Asghar Farhadi’s “Separation,” with its deliberate ambiguities and multiple points of view, looks at the complexities of life in Iran.","AS the Iranian director Asghar Farhadi’s brilliant fifth film, “A Separation,” begins, a husband and wife, married for 14 years, squirm uncomfortably in their wooden chairs inside a family court. They are arguing their case for divorce to a magistrate who is heard but not seen. As they gaze into the camera, their faces contorted with anger, the viewer is put in the judge’s shoes.",MT,12,The New York Times,"[{'rank': 0, 'subtype': 'xlarge', 'caption': None, 'credit': None, 'type': 'image', 'url': 'images/2012/01/01/arts/01HOLDEN_SPAN/HOLDEN-articleLarge.jpg', 'height': 330, 'width': 600, 'legacy': {'xlarge': 'images/2012/01/01/arts/01HOLDEN_SPAN/HOLDEN-articleLarge.jpg', 'xlargewidth': 600, 'xlargeheight': 330}, 'subType': 'xlarge', 'crop_name': 'articleLarge'}, {'rank': 0, 'subtype': 'blog480', 'caption': None, 'credit': None, 'type': 'image', 'url': 'images/2012/01/01/arts/01HOLDEN_SPAN/HOLDEN-blog480.jpg', 'height': 321, 'width': 480, 'legacy': {}, 'subType': 'blog480', 'crop_name': 'blog480'}, {'rank': 0, 'subtype': 'jumbo', 'caption': None, 'credit': None, 'type': 'image', 'url': 'images/2012/01/01/arts/01HOLDEN_SPAN/HOLDEN-jumbo.jpg', 'height': 685, 'width': 1024, 'legacy': {}, 'subType': 'jumbo', 'crop_name': 'jumbo'}, {'rank': 0, 'subtype': 'popup', 'caption': None, 'credit': None, 'type': 'image', 'url': 'images/2012/01/01/arts/01HOLDEN_SPAN/HOLDEN-articleLarge.jpg', 'height': 330, 'width': 600, 'legacy': {}, 'subType': 'popup', 'crop_name': 'popup'}, {'rank': 0, 'subtype': 'sfSpan', 'caption': None, 'credit': None, 'type': 'image', 'url': 'images/2012/01/01/arts/01HOLDEN_SPAN/HOLDEN-sfSpan.jpg', 'height': 264, 'width': 395, 'legacy': {}, 'subType': 'sfSpan', 'crop_name': 'sfSpan'}, {'rank': 0, 'subtype': 'thumbnail', 'caption': None, 'credit': None, 'type': 'image', 'url': 'images/2012/01/01/arts/01HOLDEN_SPAN/HOLDEN-thumbStandard.jpg', 'height': 75, 'width': 75, 'legacy': {'thumbnail': 'images/2012/01/01/arts/01HOLDEN_SPAN/HOLDEN-thumbStandard.jpg', 'thumbnailwidth': 75, 'thumbnailheight': 75}, 'subType': 'thumbnail', 'crop_name': 'thumbStandard'}]","[{'name': 'glocations', 'value': 'Iran', 'rank': 1, 'major': 'N'}, {'name': 'persons', 'value': 'Farhadi, Asghar', 'rank': 2, 'major': 'N'}, {'name': 'subject', 'value': 'Academy Awards (Oscars)', 'rank': 3, 'major': 'N'}, {'name': 'subject', 'value': 'Movies', 'rank': 4, 'major': 'N'}]",2011-12-30T18:09:39+0000,article,Arts&Leisure,Movies,Awards Season,News,nyt://article/3ea216ed-7f4a-5f1c-8869-31972ec129f6,995,nyt://article/3ea216ed-7f4a-5f1c-8869-31972ec129f6,A Family Coming Apart at the Seams,The Oscars,,A Family Coming Apart At the Seams,,,,By Stephen Holden,"[{'firstname': 'Stephen', 'middlename': None, 'lastname': 'Holden', 'qualifier': None, 'title': None, 'role': 'reported', 'organization': '', 'rank': 1}]",,Alzheimer,
